typeName,groupName,maxProductionLimit,basePrice,published,buildTime,outputQuantity,productName,productGroup4Name,productGroup3Name,productGroup2Name,productGroup1Name,productGroup0Name
Capital Corporate Hangar Bay Blueprint,Capital Construction Blueprints,40,1670784800,1,16000,1,Capital Corporate Hangar Bay,Manufacture & Research,Components,Standard Capital Ship Components,,
Capital Core Temperature Regulator Blueprint,Capital Construction Blueprints,40,1500000000,1,16000,1,Capital Core Temperature Regulator,Manufacture & Research,Components,Standard Capital Ship Components,,
Neurolink Protection Cell Blueprint,Capital Construction Blueprints,20,1500000000,1,16000,1,Neurolink Protection Cell,Manufacture & Research,Components,Standard Capital Ship Components,,
Enhanced Neurolink Protection Cell Blueprint,Capital Construction Blueprints,40,3000000000,1,32000,1,Enhanced Neurolink Protection Cell,Manufacture & Research,Components,Standard Capital Ship Components,,
Structure EXERT Conduit Coupler Blueprint,Construction Component Blueprints,7,200000000,1,86400,1,Structure EXERT Conduit Coupler,Manufacture & Research,Components,Structure Components,,
Structure Construction Parts Blueprint,Construction Component Blueprints,7,200000000,1,86400,1,Structure Construction Parts,Manufacture & Research,Components,Structure Components,,
Structure Hangar Array Blueprint,Construction Component Blueprints,7,200000000,1,86400,1,Structure Hangar Array,Manufacture & Research,Components,Structure Components,,
Structure Storage Bay Blueprint,Construction Component Blueprints,7,200000000,1,86400,1,Structure Storage Bay,Manufacture & Research,Components,Structure Components,,
Structure Laboratory Blueprint,Construction Component Blueprints,7,200000000,1,86400,1,Structure Laboratory,Manufacture & Research,Components,Structure Components,,
Structure Factory Blueprint,Construction Component Blueprints,7,200000000,1,86400,1,Structure Factory,Manufacture & Research,Components,Structure Components,,
Structure Repair Facility Blueprint,Construction Component Blueprints,7,200000000,1,86400,1,Structure Repair Facility,Manufacture & Research,Components,Structure Components,,
Structure Reprocessing Plant Blueprint,Construction Component Blueprints,7,200000000,1,86400,1,Structure Reprocessing Plant,Manufacture & Research,Components,Structure Components,,
Structure Docking Bay Blueprint,Construction Component Blueprints,7,200000000,1,86400,1,Structure Docking Bay,Manufacture & Research,Components,Structure Components,,
Structure Market Network Blueprint,Construction Component Blueprints,7,200000000,1,86400,1,Structure Market Network,Manufacture & Research,Components,Structure Components,,
Structure Medical Center Blueprint,Construction Component Blueprints,7,200000000,1,86400,1,Structure Medical Center,Manufacture & Research,Components,Structure Components,,
Structure Office Center Blueprint,Construction Component Blueprints,7,200000000,1,86400,1,Structure Office Center,Manufacture & Research,Components,Structure Components,,
Structure Mission Network Blueprint,Construction Component Blueprints,7,200000000,1,86400,1,Structure Mission Network,Manufacture & Research,Components,Structure Components,,
Structure Electromagnetic Sensor Blueprint,Construction Component Blueprints,7,200000000,1,86400,1,Structure Electromagnetic Sensor,Manufacture & Research,Components,Structure Components,,
Structure Acceleration Coils Blueprint,Construction Component Blueprints,7,200000000,1,86400,1,Structure Acceleration Coils,Manufacture & Research,Components,Structure Components,,
Structure Advertisement Nexus Blueprint,Construction Component Blueprints,7,200000000,1,86400,1,Structure Advertisement Nexus,Manufacture & Research,Components,Structure Components,,
Spatial Attunement Unit Blueprint,Construction Component Blueprints,8000,5000000,1,75,1,Spatial Attunement Unit,Manufacture & Research,Components,Subsystem Components,,
Self-Assembling Nanolattice Blueprint,Hybrid Component Blueprints,1000,10000000,1,600,1,Self-Assembling Nanolattice,Manufacture & Research,Components,Subsystem Components,,
Optimized Nano-Engines Blueprint,Hybrid Component Blueprints,1000,10000000,1,600,1,Optimized Nano-Engines,Manufacture & Research,Components,Subsystem Components,,
Warfare Computation Core Blueprint,Hybrid Component Blueprints,1000,10000000,1,600,1,Warfare Computation Core,Manufacture & Research,Components,Subsystem Components,,
Emergent Neurovisual Interface Blueprint,Hybrid Component Blueprints,1000,10000000,1,600,1,Emergent Neurovisual Interface,Manufacture & Research,Components,Subsystem Components,,
Fullerene Intercalated Sheets Blueprint,Hybrid Component Blueprints,1000,10000000,1,600,1,Fullerene Intercalated Sheets,Manufacture & Research,Components,Subsystem Components,,
Reinforced Metallofullerene Alloys Blueprint,Hybrid Component Blueprints,1000,10000000,1,600,1,Reinforced Metallofullerene Alloys,Manufacture & Research,Components,Subsystem Components,,
Metallofullerene Plating Blueprint,Hybrid Component Blueprints,1000,10000000,1,600,1,Metallofullerene Plating,Manufacture & Research,Components,Subsystem Components,,
Electromechanical Interface Nexus Blueprint,Hybrid Component Blueprints,1000,10000000,1,600,1,Electromechanical Interface Nexus,Manufacture & Research,Components,Subsystem Components,,
Neurovisual Output Analyzer Blueprint,Hybrid Component Blueprints,1000,10000000,1,600,1,Neurovisual Output Analyzer,Manufacture & Research,Components,Subsystem Components,,
Nanowire Composites Blueprint,Hybrid Component Blueprints,1000,10000000,1,600,1,Nanowire Composites,Manufacture & Research,Components,Subsystem Components,,
Fulleroferrocene Power Conduits Blueprint,Hybrid Component Blueprints,1000,10000000,1,600,1,Fulleroferrocene Power Conduits,Manufacture & Research,Components,Subsystem Components,,
Reconfigured Subspace Calibrator Blueprint,Hybrid Component Blueprints,1000,10000000,1,600,1,Reconfigured Subspace Calibrator,Manufacture & Research,Components,Subsystem Components,,
Superconducting Magnetometric Amplifier Blueprint,Hybrid Component Blueprints,1000,10000000,1,600,1,Superconducting Magnetometric Amplifier,Manufacture & Research,Components,Subsystem Components,,
Superconducting Gravimetric Amplifier Blueprint,Hybrid Component Blueprints,1000,10000000,1,600,1,Superconducting Gravimetric Amplifier,Manufacture & Research,Components,Subsystem Components,,
Superconducting Radar Amplifier Blueprint,Hybrid Component Blueprints,1000,10000000,1,600,1,Superconducting Radar Amplifier,Manufacture & Research,Components,Subsystem Components,,
Superconducting Ladar Amplifier Blueprint,Hybrid Component Blueprints,1000,10000000,1,600,1,Superconducting Ladar Amplifier,Manufacture & Research,Components,Subsystem Components,,
R.Db - Roden Shipyards Blueprint,Tool Blueprint,200,586240,1,2500,100,R.Db - Roden Shipyards,Manufacture & Research,Research Equipment,R.Db,,
R.Db - Boundless Creations Blueprint,Tool Blueprint,200,586240,1,2500,100,R.Db - Boundless Creations,Manufacture & Research,Research Equipment,R.Db,,
R.Db - Core Complexion Blueprint,Tool Blueprint,200,586240,1,2500,100,R.Db - Core Complexion,Manufacture & Research,Research Equipment,R.Db,,
R.Db - CreoDron Blueprint,Tool Blueprint,200,586240,1,2500,100,R.Db - CreoDron,Manufacture & Research,Research Equipment,R.Db,,
R.Db - Duvolle Labs Blueprint,Tool Blueprint,200,586240,1,2500,100,R.Db - Duvolle Labs,Manufacture & Research,Research Equipment,R.Db,,
R.Db - Carthum Conglomerate Blueprint,Tool Blueprint,200,586240,1,2500,100,R.Db - Carthum Conglomerate,Manufacture & Research,Research Equipment,R.Db,,
R.Db - Kaalakiota Blueprint,Tool Blueprint,200,586240,1,2500,100,R.Db - Kaalakiota,Manufacture & Research,Research Equipment,R.Db,,
R.Db - Khanid Innovation Blueprint,Tool Blueprint,200,586240,1,2500,100,R.Db - Khanid Innovation,Manufacture & Research,Research Equipment,R.Db,,
R.Db - Thukker Mix Blueprint,Tool Blueprint,200,586240,1,2500,100,R.Db - Thukker Mix,Manufacture & Research,Research Equipment,R.Db,,
R.Db - Viziam Blueprint,Tool Blueprint,200,586240,1,2500,100,R.Db - Viziam,Manufacture & Research,Research Equipment,R.Db,,
R.Db - Ishukone Blueprint,Tool Blueprint,200,586240,1,2500,100,R.Db - Ishukone,Manufacture & Research,Research Equipment,R.Db,,
R.Db - Lai Dai Blueprint,Tool Blueprint,200,586240,1,2500,100,R.Db - Lai Dai,Manufacture & Research,Research Equipment,R.Db,,
Customs Office Gantry Blueprint,Starbase Blueprint,3,25000001,1,60000,1,Customs Office Gantry,Planetary Infrastructure,Orbital Infrastructure,,,
Capital Transverse Bulkhead I Blueprint,Rig Blueprint,30,50000000,1,6000,1,Capital Transverse Bulkhead I,Ship and Module Modifications,Rigs,Armor Rigs,Capital Armor Rigs,
Capital Transverse Bulkhead II Blueprint,Rig Blueprint,1,125000,1,60000,1,Capital Transverse Bulkhead II,Ship and Module Modifications,Rigs,Armor Rigs,Capital Armor Rigs,
Capital Auxiliary Nano Pump I Blueprint,Rig Blueprint,30,50000000,1,6000,1,Capital Auxiliary Nano Pump I,Ship and Module Modifications,Rigs,Armor Rigs,Capital Armor Rigs,
Capital Nanobot Accelerator II Blueprint,Rig Blueprint,1,50000000,1,60000,1,Capital Nanobot Accelerator II,Ship and Module Modifications,Rigs,Armor Rigs,Capital Armor Rigs,
Capital Trimark Armor Pump I Blueprint,Rig Blueprint,30,50000000,1,6000,1,Capital Trimark Armor Pump I,Ship and Module Modifications,Rigs,Armor Rigs,Capital Armor Rigs,
Capital EM Armor Reinforcer I Blueprint,Rig Blueprint,30,50000000,1,6000,1,Capital EM Armor Reinforcer I,Ship and Module Modifications,Rigs,Armor Rigs,Capital Armor Rigs,
Capital EM Armor Reinforcer II Blueprint,Rig Blueprint,1,50000000,1,60000,1,Capital EM Armor Reinforcer II,Ship and Module Modifications,Rigs,Armor Rigs,Capital Armor Rigs,
Capital Explosive Armor Reinforcer I Blueprint,Rig Blueprint,30,50000000,1,6000,1,Capital Explosive Armor Reinforcer I,Ship and Module Modifications,Rigs,Armor Rigs,Capital Armor Rigs,
Capital Explosive Armor Reinforcer II Blueprint,Rig Blueprint,1,50000000,1,60000,1,Capital Explosive Armor Reinforcer II,Ship and Module Modifications,Rigs,Armor Rigs,Capital Armor Rigs,
Capital Kinetic Armor Reinforcer I Blueprint,Rig Blueprint,30,50000000,1,6000,1,Capital Kinetic Armor Reinforcer I,Ship and Module Modifications,Rigs,Armor Rigs,Capital Armor Rigs,
Capital Kinetic Armor Reinforcer II Blueprint,Rig Blueprint,1,50000000,1,60000,1,Capital Kinetic Armor Reinforcer II,Ship and Module Modifications,Rigs,Armor Rigs,Capital Armor Rigs,
Capital Thermal Armor Reinforcer I Blueprint,Rig Blueprint,30,50000000,1,6000,1,Capital Thermal Armor Reinforcer I,Ship and Module Modifications,Rigs,Armor Rigs,Capital Armor Rigs,
Capital Thermal Armor Reinforcer II Blueprint,Rig Blueprint,1,50000000,1,60000,1,Capital Thermal Armor Reinforcer II,Ship and Module Modifications,Rigs,Armor Rigs,Capital Armor Rigs,
Capital Auxiliary Nano Pump II Blueprint,Rig Blueprint,1,50000000,1,60000,1,Capital Auxiliary Nano Pump II,Ship and Module Modifications,Rigs,Armor Rigs,Capital Armor Rigs,
Capital Trimark Armor Pump II Blueprint,Rig Blueprint,1,50000000,1,60000,1,Capital Trimark Armor Pump II,Ship and Module Modifications,Rigs,Armor Rigs,Capital Armor Rigs,
Capital Nanobot Accelerator I Blueprint,Rig Blueprint,30,50000000,1,6000,1,Capital Nanobot Accelerator I,Ship and Module Modifications,Rigs,Armor Rigs,Capital Armor Rigs,
Capital Remote Repair Augmentor I Blueprint,Rig Blueprint,30,50000000,1,6000,1,Capital Remote Repair Augmentor I,Ship and Module Modifications,Rigs,Armor Rigs,Capital Armor Rigs,
Capital Remote Repair Augmentor II Blueprint,Rig Blueprint,1,50000000,1,60000,1,Capital Remote Repair Augmentor II,Ship and Module Modifications,Rigs,Armor Rigs,Capital Armor Rigs,
Large EM Armor Reinforcer II Blueprint,Rig Blueprint,1,1250000,1,45000,1,Large EM Armor Reinforcer II,Ship and Module Modifications,Rigs,Armor Rigs,Large Armor Rigs,
Large Explosive Armor Reinforcer II Blueprint,Rig Blueprint,1,1250000,1,45000,1,Large Explosive Armor Reinforcer II,Ship and Module Modifications,Rigs,Armor Rigs,Large Armor Rigs,
Large Kinetic Armor Reinforcer II Blueprint,Rig Blueprint,1,1250000,1,45000,1,Large Kinetic Armor Reinforcer II,Ship and Module Modifications,Rigs,Armor Rigs,Large Armor Rigs,
Large Thermal Armor Reinforcer II Blueprint,Rig Blueprint,1,1250000,1,45000,1,Large Thermal Armor Reinforcer II,Ship and Module Modifications,Rigs,Armor Rigs,Large Armor Rigs,
Large Auxiliary Nano Pump II Blueprint,Rig Blueprint,1,1250000,1,45000,1,Large Auxiliary Nano Pump II,Ship and Module Modifications,Rigs,Armor Rigs,Large Armor Rigs,
Large Nanobot Accelerator II Blueprint,Rig Blueprint,1,1250000,1,45000,1,Large Nanobot Accelerator II,Ship and Module Modifications,Rigs,Armor Rigs,Large Armor Rigs,
Large Remote Repair Augmentor II Blueprint,Rig Blueprint,1,1250000,1,45000,1,Large Remote Repair Augmentor II,Ship and Module Modifications,Rigs,Armor Rigs,Large Armor Rigs,
Large Trimark Armor Pump II Blueprint,Rig Blueprint,1,1250000,1,45000,1,Large Trimark Armor Pump II,Ship and Module Modifications,Rigs,Armor Rigs,Large Armor Rigs,
Large Transverse Bulkhead I Blueprint,Rig Blueprint,40,1250000,1,4500,1,Large Transverse Bulkhead I,Ship and Module Modifications,Rigs,Armor Rigs,Large Armor Rigs,
Large Transverse Bulkhead II Blueprint,Rig Blueprint,1,125000,1,45000,1,Large Transverse Bulkhead II,Ship and Module Modifications,Rigs,Armor Rigs,Large Armor Rigs,
Large EM Armor Reinforcer I Blueprint,Rig Blueprint,40,1250000,1,4500,1,Large EM Armor Reinforcer I,Ship and Module Modifications,Rigs,Armor Rigs,Large Armor Rigs,
Large Explosive Armor Reinforcer I Blueprint,Rig Blueprint,40,1250000,1,4500,1,Large Explosive Armor Reinforcer I,Ship and Module Modifications,Rigs,Armor Rigs,Large Armor Rigs,
Large Kinetic Armor Reinforcer I Blueprint,Rig Blueprint,40,1250000,1,4500,1,Large Kinetic Armor Reinforcer I,Ship and Module Modifications,Rigs,Armor Rigs,Large Armor Rigs,
Large Thermal Armor Reinforcer I Blueprint,Rig Blueprint,40,1250000,1,4500,1,Large Thermal Armor Reinforcer I,Ship and Module Modifications,Rigs,Armor Rigs,Large Armor Rigs,
Large Trimark Armor Pump I Blueprint,Rig Blueprint,40,1250000,1,4500,1,Large Trimark Armor Pump I,Ship and Module Modifications,Rigs,Armor Rigs,Large Armor Rigs,
Large Auxiliary Nano Pump I Blueprint,Rig Blueprint,40,1250000,1,4500,1,Large Auxiliary Nano Pump I,Ship and Module Modifications,Rigs,Armor Rigs,Large Armor Rigs,
Large Nanobot Accelerator I Blueprint,Rig Blueprint,40,1250000,1,4500,1,Large Nanobot Accelerator I,Ship and Module Modifications,Rigs,Armor Rigs,Large Armor Rigs,
Large Remote Repair Augmentor I Blueprint,Rig Blueprint,40,1250000,1,4500,1,Large Remote Repair Augmentor I,Ship and Module Modifications,Rigs,Armor Rigs,Large Armor Rigs,
Medium Transverse Bulkhead I Blueprint,Rig Blueprint,60,750000,1,3000,1,Medium Transverse Bulkhead I,Ship and Module Modifications,Rigs,Armor Rigs,Medium Armor Rigs,
Medium Transverse Bulkhead II Blueprint,Rig Blueprint,1,125000,1,30000,1,Medium Transverse Bulkhead II,Ship and Module Modifications,Rigs,Armor Rigs,Medium Armor Rigs,
Medium EM Armor Reinforcer I Blueprint,Rig Blueprint,60,750000,1,3000,1,Medium EM Armor Reinforcer I,Ship and Module Modifications,Rigs,Armor Rigs,Medium Armor Rigs,
Medium EM Armor Reinforcer II Blueprint,Rig Blueprint,1,750000,1,30000,1,Medium EM Armor Reinforcer II,Ship and Module Modifications,Rigs,Armor Rigs,Medium Armor Rigs,
Medium Explosive Armor Reinforcer I Blueprint,Rig Blueprint,60,750000,1,3000,1,Medium Explosive Armor Reinforcer I,Ship and Module Modifications,Rigs,Armor Rigs,Medium Armor Rigs,
Medium Explosive Armor Reinforcer II Blueprint,Rig Blueprint,1,750000,1,30000,1,Medium Explosive Armor Reinforcer II,Ship and Module Modifications,Rigs,Armor Rigs,Medium Armor Rigs,
Medium Kinetic Armor Reinforcer I Blueprint,Rig Blueprint,60,750000,1,3000,1,Medium Kinetic Armor Reinforcer I,Ship and Module Modifications,Rigs,Armor Rigs,Medium Armor Rigs,
Medium Kinetic Armor Reinforcer II Blueprint,Rig Blueprint,1,750000,1,30000,1,Medium Kinetic Armor Reinforcer II,Ship and Module Modifications,Rigs,Armor Rigs,Medium Armor Rigs,
Medium Thermal Armor Reinforcer I Blueprint,Rig Blueprint,60,750000,1,3000,1,Medium Thermal Armor Reinforcer I,Ship and Module Modifications,Rigs,Armor Rigs,Medium Armor Rigs,
Medium Thermal Armor Reinforcer II Blueprint,Rig Blueprint,1,750000,1,30000,1,Medium Thermal Armor Reinforcer II,Ship and Module Modifications,Rigs,Armor Rigs,Medium Armor Rigs,
Medium Auxiliary Nano Pump I Blueprint,Rig Blueprint,60,750000,1,3000,1,Medium Auxiliary Nano Pump I,Ship and Module Modifications,Rigs,Armor Rigs,Medium Armor Rigs,
Medium Auxiliary Nano Pump II Blueprint,Rig Blueprint,1,750000,1,30000,1,Medium Auxiliary Nano Pump II,Ship and Module Modifications,Rigs,Armor Rigs,Medium Armor Rigs,
Medium Trimark Armor Pump I Blueprint,Rig Blueprint,60,750000,1,3000,1,Medium Trimark Armor Pump I,Ship and Module Modifications,Rigs,Armor Rigs,Medium Armor Rigs,
Medium Trimark Armor Pump II Blueprint,Rig Blueprint,1,750000,1,30000,1,Medium Trimark Armor Pump II,Ship and Module Modifications,Rigs,Armor Rigs,Medium Armor Rigs,
Medium Nanobot Accelerator I Blueprint,Rig Blueprint,60,750000,1,3000,1,Medium Nanobot Accelerator I,Ship and Module Modifications,Rigs,Armor Rigs,Medium Armor Rigs,
Medium Nanobot Accelerator II Blueprint,Rig Blueprint,1,750000,1,30000,1,Medium Nanobot Accelerator II,Ship and Module Modifications,Rigs,Armor Rigs,Medium Armor Rigs,
Medium Remote Repair Augmentor I Blueprint,Rig Blueprint,60,750000,1,3000,1,Medium Remote Repair Augmentor I,Ship and Module Modifications,Rigs,Armor Rigs,Medium Armor Rigs,
Medium Remote Repair Augmentor II Blueprint,Rig Blueprint,1,750000,1,30000,1,Medium Remote Repair Augmentor II,Ship and Module Modifications,Rigs,Armor Rigs,Medium Armor Rigs,
Small Trimark Armor Pump I Blueprint,Rig Blueprint,100,125000,1,1500,1,Small Trimark Armor Pump I,Ship and Module Modifications,Rigs,Armor Rigs,Small Armor Rigs,
Small EM Armor Reinforcer I Blueprint,Rig Blueprint,100,125000,1,1500,1,Small EM Armor Reinforcer I,Ship and Module Modifications,Rigs,Armor Rigs,Small Armor Rigs,
Small EM Armor Reinforcer II Blueprint,Rig Blueprint,1,125000,1,15000,1,Small EM Armor Reinforcer II,Ship and Module Modifications,Rigs,Armor Rigs,Small Armor Rigs,
Small Explosive Armor Reinforcer I Blueprint,Rig Blueprint,100,125000,1,1500,1,Small Explosive Armor Reinforcer I,Ship and Module Modifications,Rigs,Armor Rigs,Small Armor Rigs,
Small Explosive Armor Reinforcer II Blueprint,Rig Blueprint,1,125000,1,15000,1,Small Explosive Armor Reinforcer II,Ship and Module Modifications,Rigs,Armor Rigs,Small Armor Rigs,
Small Kinetic Armor Reinforcer I Blueprint,Rig Blueprint,100,125000,1,1500,1,Small Kinetic Armor Reinforcer I,Ship and Module Modifications,Rigs,Armor Rigs,Small Armor Rigs,
Small Kinetic Armor Reinforcer II Blueprint,Rig Blueprint,1,125000,1,15000,1,Small Kinetic Armor Reinforcer II,Ship and Module Modifications,Rigs,Armor Rigs,Small Armor Rigs,
Small Thermal Armor Reinforcer I Blueprint,Rig Blueprint,100,125000,1,1500,1,Small Thermal Armor Reinforcer I,Ship and Module Modifications,Rigs,Armor Rigs,Small Armor Rigs,
Small Thermal Armor Reinforcer II Blueprint,Rig Blueprint,1,125000,1,15000,1,Small Thermal Armor Reinforcer II,Ship and Module Modifications,Rigs,Armor Rigs,Small Armor Rigs,
Small Auxiliary Nano Pump I Blueprint,Rig Blueprint,100,125000,1,1500,1,Small Auxiliary Nano Pump I,Ship and Module Modifications,Rigs,Armor Rigs,Small Armor Rigs,
Small Auxiliary Nano Pump II Blueprint,Rig Blueprint,1,125000,1,15000,1,Small Auxiliary Nano Pump II,Ship and Module Modifications,Rigs,Armor Rigs,Small Armor Rigs,
Small Trimark Armor Pump II Blueprint,Rig Blueprint,1,125000,1,15000,1,Small Trimark Armor Pump II,Ship and Module Modifications,Rigs,Armor Rigs,Small Armor Rigs,
Small Nanobot Accelerator I Blueprint,Rig Blueprint,100,125000,1,1500,1,Small Nanobot Accelerator I,Ship and Module Modifications,Rigs,Armor Rigs,Small Armor Rigs,
Small Nanobot Accelerator II Blueprint,Rig Blueprint,1,125000,1,15000,1,Small Nanobot Accelerator II,Ship and Module Modifications,Rigs,Armor Rigs,Small Armor Rigs,
Small Remote Repair Augmentor II Blueprint,Rig Blueprint,1,125000,1,15000,1,Small Remote Repair Augmentor II,Ship and Module Modifications,Rigs,Armor Rigs,Small Armor Rigs,
Small Transverse Bulkhead I Blueprint,Rig Blueprint,100,125000,1,1500,1,Small Transverse Bulkhead I,Ship and Module Modifications,Rigs,Armor Rigs,Small Armor Rigs,
Small Transverse Bulkhead II Blueprint,Rig Blueprint,1,125000,1,15000,1,Small Transverse Bulkhead II,Ship and Module Modifications,Rigs,Armor Rigs,Small Armor Rigs,
Small Remote Repair Augmentor I Blueprint,Rig Blueprint,100,125000,1,1500,1,Small Remote Repair Augmentor I,Ship and Module Modifications,Rigs,Armor Rigs,Small Armor Rigs,
Capital Higgs Anchor I Blueprint,Rig Blueprint,30,50000000,1,6000,1,Capital Higgs Anchor I,Ship and Module Modifications,Rigs,Astronautic Rigs,Capital Astronautic Rigs,
Capital Auxiliary Thrusters I Blueprint,Rig Blueprint,30,50000000,1,6000,1,Capital Auxiliary Thrusters I,Ship and Module Modifications,Rigs,Astronautic Rigs,Capital Astronautic Rigs,
Capital Auxiliary Thrusters II Blueprint,Rig Blueprint,1,50000000,1,60000,1,Capital Auxiliary Thrusters II,Ship and Module Modifications,Rigs,Astronautic Rigs,Capital Astronautic Rigs,
Capital Cargohold Optimization I Blueprint,Rig Blueprint,30,50000000,1,6000,1,Capital Cargohold Optimization I,Ship and Module Modifications,Rigs,Astronautic Rigs,Capital Astronautic Rigs,
Capital Cargohold Optimization II Blueprint,Rig Blueprint,1,50000000,1,60000,1,Capital Cargohold Optimization II,Ship and Module Modifications,Rigs,Astronautic Rigs,Capital Astronautic Rigs,
Capital Dynamic Fuel Valve I Blueprint,Rig Blueprint,30,50000000,1,6000,1,Capital Dynamic Fuel Valve I,Ship and Module Modifications,Rigs,Astronautic Rigs,Capital Astronautic Rigs,
Capital Dynamic Fuel Valve II Blueprint,Rig Blueprint,1,50000000,1,60000,1,Capital Dynamic Fuel Valve II,Ship and Module Modifications,Rigs,Astronautic Rigs,Capital Astronautic Rigs,
Capital Engine Thermal Shielding I Blueprint,Rig Blueprint,30,50000000,1,6000,1,Capital Engine Thermal Shielding I,Ship and Module Modifications,Rigs,Astronautic Rigs,Capital Astronautic Rigs,
Capital Engine Thermal Shielding II Blueprint,Rig Blueprint,1,50000000,1,60000,1,Capital Engine Thermal Shielding II,Ship and Module Modifications,Rigs,Astronautic Rigs,Capital Astronautic Rigs,
Capital Low Friction Nozzle Joints I Blueprint,Rig Blueprint,30,50000000,1,6000,1,Capital Low Friction Nozzle Joints I,Ship and Module Modifications,Rigs,Astronautic Rigs,Capital Astronautic Rigs,
Capital Hyperspatial Velocity Optimizer I Blueprint,Rig Blueprint,30,50000000,1,6000,1,Capital Hyperspatial Velocity Optimizer I,Ship and Module Modifications,Rigs,Astronautic Rigs,Capital Astronautic Rigs,
Capital Hyperspatial Velocity Optimizer II Blueprint,Rig Blueprint,1,50000000,1,60000,1,Capital Hyperspatial Velocity Optimizer II,Ship and Module Modifications,Rigs,Astronautic Rigs,Capital Astronautic Rigs,
Capital Low Friction Nozzle Joints II Blueprint,Rig Blueprint,1,50000000,1,60000,1,Capital Low Friction Nozzle Joints II,Ship and Module Modifications,Rigs,Astronautic Rigs,Capital Astronautic Rigs,
Capital Polycarbon Engine Housing I Blueprint,Rig Blueprint,30,50000000,1,6000,1,Capital Polycarbon Engine Housing I,Ship and Module Modifications,Rigs,Astronautic Rigs,Capital Astronautic Rigs,
Capital Polycarbon Engine Housing II Blueprint,Rig Blueprint,1,50000000,1,60000,1,Capital Polycarbon Engine Housing II,Ship and Module Modifications,Rigs,Astronautic Rigs,Capital Astronautic Rigs,
Capital Warp Core Optimizer I Blueprint,Rig Blueprint,30,50000000,1,6000,1,Capital Warp Core Optimizer I,Ship and Module Modifications,Rigs,Astronautic Rigs,Capital Astronautic Rigs,
Capital Warp Core Optimizer II Blueprint,Rig Blueprint,1,50000000,1,60000,1,Capital Warp Core Optimizer II,Ship and Module Modifications,Rigs,Astronautic Rigs,Capital Astronautic Rigs,
Large Higgs Anchor I Blueprint,Rig Blueprint,40,1250000,1,4500,1,Large Higgs Anchor I,Ship and Module Modifications,Rigs,Astronautic Rigs,Large Astronautic Rigs,
Large Dynamic Fuel Valve I Blueprint,Rig Blueprint,40,1250000,1,4500,1,Large Dynamic Fuel Valve I,Ship and Module Modifications,Rigs,Astronautic Rigs,Large Astronautic Rigs,
Large Low Friction Nozzle Joints I Blueprint,Rig Blueprint,40,1250000,1,4500,1,Large Low Friction Nozzle Joints I,Ship and Module Modifications,Rigs,Astronautic Rigs,Large Astronautic Rigs,
Large Auxiliary Thrusters I Blueprint,Rig Blueprint,40,1250000,1,4500,1,Large Auxiliary Thrusters I,Ship and Module Modifications,Rigs,Astronautic Rigs,Large Astronautic Rigs,
Large Engine Thermal Shielding I Blueprint,Rig Blueprint,40,1250000,1,4500,1,Large Engine Thermal Shielding I,Ship and Module Modifications,Rigs,Astronautic Rigs,Large Astronautic Rigs,
Large Warp Core Optimizer I Blueprint,Rig Blueprint,40,1250000,1,4500,1,Large Warp Core Optimizer I,Ship and Module Modifications,Rigs,Astronautic Rigs,Large Astronautic Rigs,
Large Hyperspatial Velocity Optimizer I Blueprint,Rig Blueprint,40,1250000,1,4500,1,Large Hyperspatial Velocity Optimizer I,Ship and Module Modifications,Rigs,Astronautic Rigs,Large Astronautic Rigs,
Large Polycarbon Engine Housing I Blueprint,Rig Blueprint,40,1250000,1,4500,1,Large Polycarbon Engine Housing I,Ship and Module Modifications,Rigs,Astronautic Rigs,Large Astronautic Rigs,
Large Cargohold Optimization I Blueprint,Rig Blueprint,40,1250000,1,4500,1,Large Cargohold Optimization I,Ship and Module Modifications,Rigs,Astronautic Rigs,Large Astronautic Rigs,
