typeName,groupName,maxProductionLimit,basePrice,published,buildTime,outputQuantity,productName,productGroup4Name,productGroup3Name,productGroup2Name,productGroup1Name,productGroup0Name
Pulse Activated Nexus Invulnerability Core Blueprint,Super Weapon Blueprint,2,200000000,1,54000,1,Pulse Activated Nexus Invulnerability Core,Ship Equipment,Turrets & Launchers,Superweapons,ORE,
Large Consortium Vorton Projector Blueprint,Vorton Projector Blueprint,60,120000,1,2700,1,Large Consortium Vorton Projector,Ship Equipment,Turrets & Launchers,Vorton Projectors,Large,
Large Vorton Projector I Blueprint,Vorton Projector Blueprint,60,120000,1,2700,1,Large Vorton Projector I,Ship Equipment,Turrets & Launchers,Vorton Projectors,Large,
Large Compact Vorton Projector Blueprint,Vorton Projector Blueprint,60,120000,1,2700,1,Large Compact Vorton Projector,Ship Equipment,Turrets & Launchers,Vorton Projectors,Large,
Large Scoped Vorton Projector Blueprint,Vorton Projector Blueprint,60,120000,1,2700,1,Large Scoped Vorton Projector,Ship Equipment,Turrets & Launchers,Vorton Projectors,Large,
Large Vorton Projector II Blueprint,Vorton Projector Blueprint,10,120000,1,7020,1,Large Vorton Projector II,Ship Equipment,Turrets & Launchers,Vorton Projectors,Large,
Medium Vorton Projector I Blueprint,Vorton Projector Blueprint,100,120000,1,1800,1,Medium Vorton Projector I,Ship Equipment,Turrets & Launchers,Vorton Projectors,Medium,
Medium Compact Vorton Projector Blueprint,Vorton Projector Blueprint,100,120000,1,1800,1,Medium Compact Vorton Projector,Ship Equipment,Turrets & Launchers,Vorton Projectors,Medium,
Medium Scoped Vorton Projector Blueprint,Vorton Projector Blueprint,100,120000,1,1800,1,Medium Scoped Vorton Projector,Ship Equipment,Turrets & Launchers,Vorton Projectors,Medium,
Medium Vorton Projector II Blueprint,Vorton Projector Blueprint,10,120000,1,4680,1,Medium Vorton Projector II,Ship Equipment,Turrets & Launchers,Vorton Projectors,Medium,
Medium Consortium Vorton Projector Blueprint,Vorton Projector Blueprint,100,120000,1,1800,1,Medium Consortium Vorton Projector,Ship Equipment,Turrets & Launchers,Vorton Projectors,Medium,
Small Vorton Projector I Blueprint,Vorton Projector Blueprint,200,120000,1,900,1,Small Vorton Projector I,Ship Equipment,Turrets & Launchers,Vorton Projectors,Small,
Small Compact Vorton Projector Blueprint,Vorton Projector Blueprint,200,120000,1,900,1,Small Compact Vorton Projector,Ship Equipment,Turrets & Launchers,Vorton Projectors,Small,
Small Scoped Vorton Projector Blueprint,Vorton Projector Blueprint,200,120000,1,900,1,Small Scoped Vorton Projector,Ship Equipment,Turrets & Launchers,Vorton Projectors,Small,
Small Vorton Projector II Blueprint,Vorton Projector Blueprint,10,120000,1,2340,1,Small Vorton Projector II,Ship Equipment,Turrets & Launchers,Vorton Projectors,Small,
Small Consortium Vorton Projector Blueprint,Vorton Projector Blueprint,200,120000,1,900,1,Small Consortium Vorton Projector,Ship Equipment,Turrets & Launchers,Vorton Projectors,Small,
ML-EKP 'Polybolos' Ballistic Control System Blueprint,Ballistic Control System Blueprint,3,499200,1,180,1,ML-EKP 'Polybolos' Ballistic Control System,Ship Equipment,Turrets & Launchers,Weapon Upgrades,Ballistic Control Systems,
Full Duplex' Ballistic Control System Blueprint,Ballistic Control System Blueprint,200,NULL,1,900,1,Full Duplex' Ballistic Control System,Ship Equipment,Turrets & Launchers,Weapon Upgrades,Ballistic Control Systems,
Ballistic Control System II Blueprint,Ballistic Control System Blueprint,10,10000000000,1,2340,1,Ballistic Control System II,Ship Equipment,Turrets & Launchers,Weapon Upgrades,Ballistic Control Systems,
Ballistic Control System I Blueprint,Ballistic Control System Blueprint,200,499200,1,900,1,Ballistic Control System I,Ship Equipment,Turrets & Launchers,Weapon Upgrades,Ballistic Control Systems,
Caldari Navy Ballistic Control System Blueprint,Ballistic Control System Blueprint,200,NULL,1,900,1,Caldari Navy Ballistic Control System,Ship Equipment,Turrets & Launchers,Weapon Upgrades,Ballistic Control Systems,
Republic Fleet Ballistic Control System Blueprint,Ballistic Control System Blueprint,200,NULL,1,900,1,Republic Fleet Ballistic Control System,Ship Equipment,Turrets & Launchers,Weapon Upgrades,Ballistic Control Systems,
Khanid Navy Ballistic Control System Blueprint,Ballistic Control System Blueprint,200,NULL,1,900,1,Khanid Navy Ballistic Control System,Ship Equipment,Turrets & Launchers,Weapon Upgrades,Ballistic Control Systems,
Entropic Radiation Sink I Blueprint,Entropic Radiation Sink Blueprint,200,249600,1,900,1,Entropic Radiation Sink I,Ship Equipment,Turrets & Launchers,Weapon Upgrades,Entropic Radiation Sinks,
Entropic Radiation Sink II Blueprint,Entropic Radiation Sink Blueprint,10,10000000000,1,2340,1,Entropic Radiation Sink II,Ship Equipment,Turrets & Launchers,Weapon Upgrades,Entropic Radiation Sinks,
Zorya's Entropic Radiation Sink Blueprint,Entropic Radiation Sink Blueprint,200,249600,1,900,1,Zorya's Entropic Radiation Sink,Ship Equipment,Turrets & Launchers,Weapon Upgrades,Entropic Radiation Sinks,
Veles Entropic Radiation Sink Blueprint,Entropic Radiation Sink Blueprint,200,249600,1,900,1,Veles Entropic Radiation Sink,Ship Equipment,Turrets & Launchers,Weapon Upgrades,Entropic Radiation Sinks,
Vadari's Custom Gyrostabilizer Blueprint,Gunnery Upgrade Blueprint,2,243200,1,25200,1,Vadari's Custom Gyrostabilizer,Ship Equipment,Turrets & Launchers,Weapon Upgrades,Gyrostabilizers,
Republic Fleet Gyrostabilizer Blueprint,Gunnery Upgrade Blueprint,200,NULL,1,900,1,Republic Fleet Gyrostabilizer,Ship Equipment,Turrets & Launchers,Weapon Upgrades,Gyrostabilizers,
Kindred' Gyrostabilizer Blueprint,Gunnery Upgrade Blueprint,200,NULL,1,900,1,Kindred' Gyrostabilizer,Ship Equipment,Turrets & Launchers,Weapon Upgrades,Gyrostabilizers,
Gyrostabilizer II Blueprint,Gunnery Upgrade Blueprint,10,10000000000,1,2340,1,Gyrostabilizer II,Ship Equipment,Turrets & Launchers,Weapon Upgrades,Gyrostabilizers,
Gyrostabilizer I Blueprint,Gunnery Upgrade Blueprint,200,243200,1,900,1,Gyrostabilizer I,Ship Equipment,Turrets & Launchers,Weapon Upgrades,Gyrostabilizers,
Heat Sink I Blueprint,Heat Sink Blueprint,200,249600,1,900,1,Heat Sink I,Ship Equipment,Turrets & Launchers,Weapon Upgrades,Heat Sinks,
Heat Sink II Blueprint,Heat Sink Blueprint,10,10000000000,1,2340,1,Heat Sink II,Ship Equipment,Turrets & Launchers,Weapon Upgrades,Heat Sinks,
Trebuchet' Heat Sink Blueprint,Heat Sink Blueprint,200,NULL,1,900,1,Trebuchet' Heat Sink I,Ship Equipment,Turrets & Launchers,Weapon Upgrades,Heat Sinks,
Ammatar Navy Heat Sink Blueprint,Heat Sink Blueprint,200,NULL,1,900,1,Ammatar Navy Heat Sink,Ship Equipment,Turrets & Launchers,Weapon Upgrades,Heat Sinks,
Imperial Navy Heat Sink Blueprint,Heat Sink Blueprint,200,NULL,1,900,1,Imperial Navy Heat Sink,Ship Equipment,Turrets & Launchers,Weapon Upgrades,Heat Sinks,
Tahron's Custom Heat Sink Blueprint,Heat Sink Blueprint,2,249600,1,25200,1,Tahron's Custom Heat Sink,Ship Equipment,Turrets & Launchers,Weapon Upgrades,Heat Sinks,
Torelle's Custom Magnetic Field Stabilizer Blueprint,Gunnery Upgrade Blueprint,2,249940,1,25200,1,Torelle's Custom Magnetic Field Stabilizer,Ship Equipment,Turrets & Launchers,Weapon Upgrades,Magnetic Field Stabilizers,
Kaatara's Custom Magnetic Field Stabilizer Blueprint,Gunnery Upgrade Blueprint,2,249940,1,25200,1,Kaatara's Custom Magnetic Field Stabilizer,Ship Equipment,Turrets & Launchers,Weapon Upgrades,Magnetic Field Stabilizers,
Federation Navy Magnetic Field Stabilizer Blueprint,Gunnery Upgrade Blueprint,200,NULL,1,900,1,Federation Navy Magnetic Field Stabilizer,Ship Equipment,Turrets & Launchers,Weapon Upgrades,Magnetic Field Stabilizers,
Magnetic Field Stabilizer I Blueprint,Gunnery Upgrade Blueprint,200,249940,1,900,1,Magnetic Field Stabilizer I,Ship Equipment,Turrets & Launchers,Weapon Upgrades,Magnetic Field Stabilizers,
Magnetic Field Stabilizer II Blueprint,Gunnery Upgrade Blueprint,10,10000000000,1,2340,1,Magnetic Field Stabilizer II,Ship Equipment,Turrets & Launchers,Weapon Upgrades,Magnetic Field Stabilizers,
Monopoly' Magnetic Field Stabilizer Blueprint,Gunnery Upgrade Blueprint,200,NULL,1,900,1,Monopoly' Magnetic Field Stabilizer,Ship Equipment,Turrets & Launchers,Weapon Upgrades,Magnetic Field Stabilizers,
Missile Guidance Computer I Blueprint,Missile Guidance Computer Blueprint,100,99000,1,1800,1,Missile Guidance Computer I,Ship Equipment,Turrets & Launchers,Weapon Upgrades,Missile Guidance Computers,
Missile Guidance Computer II Blueprint,Missile Guidance Computer Blueprint,10,NULL,1,4680,1,Missile Guidance Computer II,Ship Equipment,Turrets & Launchers,Weapon Upgrades,Missile Guidance Computers,
Missile Guidance Enhancer I Blueprint,Missile Guidance Enhancer Blueprint,200,144000,1,900,1,Missile Guidance Enhancer I,Ship Equipment,Turrets & Launchers,Weapon Upgrades,Missile Guidance Enhancers,
Missile Guidance Enhancer II Blueprint,Missile Guidance Enhancer Blueprint,10,NULL,1,2340,1,Missile Guidance Enhancer II,Ship Equipment,Turrets & Launchers,Weapon Upgrades,Missile Guidance Enhancers,
Enterprise' Remote Tracking Computer Blueprint,Remote Tracking Computer Blueprint,100,NULL,1,1800,1,Enterprise' Remote Tracking Computer,Ship Equipment,Turrets & Launchers,Weapon Upgrades,Remote Tracking Computers,
Federation Navy Remote Tracking Computer Blueprint,Remote Tracking Computer Blueprint,100,NULL,1,1800,1,Federation Navy Remote Tracking Computer,Ship Equipment,Turrets & Launchers,Weapon Upgrades,Remote Tracking Computers,
Remote Tracking Computer I Blueprint,Remote Tracking Computer Blueprint,100,299940,1,1800,1,Remote Tracking Computer I,Ship Equipment,Turrets & Launchers,Weapon Upgrades,Remote Tracking Computers,
Remote Tracking Computer II Blueprint,Remote Tracking Computer Blueprint,10,10000000000,1,4680,1,Remote Tracking Computer II,Ship Equipment,Turrets & Launchers,Weapon Upgrades,Remote Tracking Computers,
Siege Module I Blueprint,Siege Module Blueprint,3,522349680,1,54000,1,Siege Module I,Ship Equipment,Turrets & Launchers,Weapon Upgrades,Siege Modules,
Siege Module II Blueprint,Siege Module Blueprint,10,522349680,1,140400,1,Siege Module II,Ship Equipment,Turrets & Launchers,Weapon Upgrades,Siege Modules,
Triage Module II Blueprint,Siege Module Blueprint,10,522349680,1,140400,1,Triage Module II,Ship Equipment,Turrets & Launchers,Weapon Upgrades,Siege Modules,
Triage Module I Blueprint,Siege Module Blueprint,3,522349680,1,54000,1,Triage Module I,Ship Equipment,Turrets & Launchers,Weapon Upgrades,Siege Modules,
Industrial Core I Blueprint,Siege Module Blueprint,3,522349680,1,54000,1,Industrial Core I,Ship Equipment,Turrets & Launchers,Weapon Upgrades,Siege Modules,
Bastion Module I Blueprint,Siege Module Blueprint,50,50000000,1,3600,1,Bastion Module I,Ship Equipment,Turrets & Launchers,Weapon Upgrades,Siege Modules,
Industrial Core II Blueprint,Siege Module Blueprint,10,522349680,1,140400,1,Industrial Core II,Ship Equipment,Turrets & Launchers,Weapon Upgrades,Siege Modules,
Tracking Computer I Blueprint,Tracking Computer Blueprint,100,99000,1,1800,1,Tracking Computer I,Ship Equipment,Turrets & Launchers,Weapon Upgrades,Tracking Computers,
Tracking Computer II Blueprint,Tracking Computer Blueprint,10,10000000000,1,4680,1,Tracking Computer II,Ship Equipment,Turrets & Launchers,Weapon Upgrades,Tracking Computers,
Marketeer' Tracking Computer Blueprint,Tracking Computer Blueprint,100,NULL,1,1800,1,Marketeer' Tracking Computer,Ship Equipment,Turrets & Launchers,Weapon Upgrades,Tracking Computers,
Federation Navy Tracking Computer Blueprint,Tracking Computer Blueprint,100,NULL,1,1800,1,Federation Navy Tracking Computer,Ship Equipment,Turrets & Launchers,Weapon Upgrades,Tracking Computers,
Republic Fleet Tracking Enhancer Blueprint,Tracking Enhancer Blueprint,200,NULL,1,900,1,Republic Fleet Tracking Enhancer,Ship Equipment,Turrets & Launchers,Weapon Upgrades,Tracking Enhancers,
Tracking Enhancer I Blueprint,Tracking Enhancer Blueprint,200,144000,1,900,1,Tracking Enhancer I,Ship Equipment,Turrets & Launchers,Weapon Upgrades,Tracking Enhancers,
Tracking Enhancer II Blueprint,Tracking Enhancer Blueprint,10,10000000000,1,2340,1,Tracking Enhancer II,Ship Equipment,Turrets & Launchers,Weapon Upgrades,Tracking Enhancers,
Vorton Tuning System I Blueprint,Vorton Projector Upgrade Blueprints,200,40000,1,900,1,Vorton Tuning System I,Ship Equipment,Turrets & Launchers,Weapon Upgrades,Vorton Tuning Systems,
Compact Vorton Tuning System Blueprint,Vorton Projector Upgrade Blueprints,200,40000,1,900,1,Compact Vorton Tuning System I,Ship Equipment,Turrets & Launchers,Weapon Upgrades,Vorton Tuning Systems,
Vorton Tuning System II Blueprint,Vorton Projector Upgrade Blueprints,10,40000,1,2340,1,Vorton Tuning System II,Ship Equipment,Turrets & Launchers,Weapon Upgrades,Vorton Tuning Systems,
Absolution Blueprint,Battlecruiser Blueprint,1,50000000000,1,300000,1,Absolution,Ships,Battlecruisers,Advanced Battlecruisers,Command Ships,Amarr
Damnation Blueprint,Battlecruiser Blueprint,1,50000000000,1,300000,1,Damnation,Ships,Battlecruisers,Advanced Battlecruisers,Command Ships,Amarr
Vulture Blueprint,Battlecruiser Blueprint,1,50000000000,1,300000,1,Vulture,Ships,Battlecruisers,Advanced Battlecruisers,Command Ships,Caldari
Nighthawk Blueprint,Battlecruiser Blueprint,1,50000000000,1,300000,1,Nighthawk,Ships,Battlecruisers,Advanced Battlecruisers,Command Ships,Caldari
Eos Blueprint,Battlecruiser Blueprint,1,50000000000,1,300000,1,Eos,Ships,Battlecruisers,Advanced Battlecruisers,Command Ships,Gallente
Astarte Blueprint,Battlecruiser Blueprint,1,50000000000,1,300000,1,Astarte,Ships,Battlecruisers,Advanced Battlecruisers,Command Ships,Gallente
Sleipnir Blueprint,Battlecruiser Blueprint,1,50000000000,1,300000,1,Sleipnir,Ships,Battlecruisers,Advanced Battlecruisers,Command Ships,Minmatar
Claymore Blueprint,Battlecruiser Blueprint,1,50000000000,1,300000,1,Claymore,Ships,Battlecruisers,Advanced Battlecruisers,Command Ships,Minmatar
Brutix Navy Issue Blueprint,Battlecruiser Blueprint,10,570000000,1,15000,1,Brutix Navy Issue,Ships,Battlecruisers,Faction Battlecruisers,Navy Faction,
Drake Navy Issue Blueprint,Battlecruiser Blueprint,10,580000000,1,15000,1,Drake Navy Issue,Ships,Battlecruisers,Faction Battlecruisers,Navy Faction,
Harbinger Navy Issue Blueprint,Battlecruiser Blueprint,10,585000000,1,15000,1,Harbinger Navy Issue,Ships,Battlecruisers,Faction Battlecruisers,Navy Faction,
Hurricane Fleet Issue Blueprint,Battlecruiser Blueprint,10,565000000,1,15000,1,Hurricane Fleet Issue,Ships,Battlecruisers,Faction Battlecruisers,Navy Faction,
Drekavac Blueprint,Battlecruiser Blueprint,10,NULL,1,12000,1,Drekavac,Ships,Battlecruisers,Precursor Battlecruisers,Triglavian,
Oracle Blueprint,Battlecruiser Blueprint,10,625000000,1,15000,1,Oracle,Ships,Battlecruisers,Standard Battlecruisers,Amarr,
Prophecy Blueprint,Battlecruiser Blueprint,10,555000000,1,15000,1,Prophecy,Ships,Battlecruisers,Standard Battlecruisers,Amarr,
Harbinger Blueprint,Battlecruiser Blueprint,10,585000000,1,15000,1,Harbinger,Ships,Battlecruisers,Standard Battlecruisers,Amarr,
Drake Blueprint,Battlecruiser Blueprint,10,580000000,1,15000,1,Drake,Ships,Battlecruisers,Standard Battlecruisers,Caldari,
Ferox Blueprint,Battlecruiser Blueprint,10,540000000,1,15000,1,Ferox,Ships,Battlecruisers,Standard Battlecruisers,Caldari,
Naga Blueprint,Battlecruiser Blueprint,10,615000000,1,15000,1,Naga,Ships,Battlecruisers,Standard Battlecruisers,Caldari,
Talos Blueprint,Battlecruiser Blueprint,10,650000000,1,15000,1,Talos,Ships,Battlecruisers,Standard Battlecruisers,Gallente,
Brutix Blueprint,Battlecruiser Blueprint,10,570000000,1,15000,1,Brutix,Ships,Battlecruisers,Standard Battlecruisers,Gallente,
Myrmidon Blueprint,Battlecruiser Blueprint,10,600000000,1,15000,1,Myrmidon,Ships,Battlecruisers,Standard Battlecruisers,Gallente,
Hurricane Blueprint,Battlecruiser Blueprint,10,565000000,1,15000,1,Hurricane,Ships,Battlecruisers,Standard Battlecruisers,Minmatar,
Cyclone Blueprint,Battlecruiser Blueprint,10,525000000,1,15000,1,Cyclone,Ships,Battlecruisers,Standard Battlecruisers,Minmatar,
Tornado Blueprint,Battlecruiser Blueprint,10,592000000,1,15000,1,Tornado,Ships,Battlecruisers,Standard Battlecruisers,Minmatar,
Redeemer Blueprint,Battleship Blueprint,1,NULL,1,360000,1,Redeemer,Ships,Battleships,Advanced Battleships,Black Ops,Amarr
Widow Blueprint,Battleship Blueprint,1,NULL,1,360000,1,Widow,Ships,Battleships,Advanced Battleships,Black Ops,Caldari
Sin Blueprint,Battleship Blueprint,1,NULL,1,360000,1,Sin,Ships,Battleships,Advanced Battleships,Black Ops,Gallente
Panther Blueprint,Battleship Blueprint,1,NULL,1,360000,1,Panther,Ships,Battleships,Advanced Battleships,Black Ops,Minmatar
Paladin Blueprint,Battleship Blueprint,1,1800000000,1,360000,1,Paladin,Ships,Battleships,Advanced Battleships,Marauders,Amarr
Golem Blueprint,Battleship Blueprint,1,1650000000,1,360000,1,Golem,Ships,Battleships,Advanced Battleships,Marauders,Caldari
Kronos Blueprint,Battleship Blueprint,1,1760000000,1,360000,1,Kronos,Ships,Battleships,Advanced Battleships,Marauders,Gallente
Vargur Blueprint,Battleship Blueprint,1,1450000000,1,360000,1,Vargur,Ships,Battleships,Advanced Battleships,Marauders,Minmatar
Raven Navy Issue Blueprint,Battleship Blueprint,10,NULL,1,18000,1,Raven Navy Issue,Ships,Battleships,Faction Battleships,Navy Faction,
Apocalypse Navy Issue Blueprint,Battleship Blueprint,10,NULL,1,18000,1,Apocalypse Navy Issue,Ships,Battleships,Faction Battleships,Navy Faction,
Megathron Navy Issue Blueprint,Battleship Blueprint,10,NULL,1,18000,1,Megathron Navy Issue,Ships,Battleships,Faction Battleships,Navy Faction,
Tempest Fleet Issue Blueprint,Battleship Blueprint,10,NULL,1,18000,1,Tempest Fleet Issue,Ships,Battleships,Faction Battleships,Navy Faction,
Thunderchild Blueprint,Battleship Blueprint,10,NULL,1,18000,1,Thunderchild,Ships,Battleships,Faction Battleships,Navy Faction,
Armageddon Navy Issue Blueprint,Battleship Blueprint,10,662500000,1,18000,1,Armageddon Navy Issue,Ships,Battleships,Faction Battleships,Navy Faction,
Dominix Navy Issue Blueprint,Battleship Blueprint,10,625000000,1,18000,1,Dominix Navy Issue,Ships,Battleships,Faction Battleships,Navy Faction,
Scorpion Navy Issue Blueprint,Battleship Blueprint,10,712500000,1,18000,1,Scorpion Navy Issue,Ships,Battleships,Faction Battleships,Navy Faction,
Typhoon Fleet Issue Blueprint,Battleship Blueprint,10,750000000,1,18000,1,Typhoon Fleet Issue,Ships,Battleships,Faction Battleships,Navy Faction,
Nestor Blueprint,Battleship Blueprint,10,NULL,1,18000,1,Nestor,Ships,Battleships,Faction Battleships,Pirate Faction,
Barghest Blueprint,Battleship Blueprint,10,NULL,1,18000,1,Barghest,Ships,Battleships,Faction Battleships,Pirate Faction,
Nightmare Blueprint,Battleship Blueprint,10,NULL,1,18000,1,Nightmare,Ships,Battleships,Faction Battleships,Pirate Faction,
Machariel Blueprint,Battleship Blueprint,10,NULL,1,18000,1,Machariel,Ships,Battleships,Faction Battleships,Pirate Faction,
Vindicator Blueprint,Battleship Blueprint,10,NULL,1,18000,1,Vindicator,Ships,Battleships,Faction Battleships,Pirate Faction,
Rattlesnake Blueprint,Battleship Blueprint,10,NULL,1,18000,1,Rattlesnake,Ships,Battleships,Faction Battleships,Pirate Faction,
Bhaalgorn Blueprint,Battleship Blueprint,10,NULL,1,18000,1,Bhaalgorn,Ships,Battleships,Faction Battleships,Pirate Faction,
Leshak Blueprint,Battleship Blueprint,10,NULL,1,18000,1,Leshak,Ships,Battleships,Precursor Battleships,Triglavian,
Apocalypse Blueprint,Battleship Blueprint,10,1265000000,1,18000,1,Apocalypse,Ships,Battleships,Standard Battleships,Amarr,
Armageddon Blueprint,Battleship Blueprint,10,1565000000,1,18000,1,Armageddon,Ships,Battleships,Standard Battleships,Amarr,
Abaddon Blueprint,Battleship Blueprint,10,1800000000,1,18000,1,Abaddon,Ships,Battleships,Standard Battleships,Amarr,
Rokh Blueprint,Battleship Blueprint,10,1650000000,1,18000,1,Rokh,Ships,Battleships,Standard Battleships,Caldari,
Raven Blueprint,Battleship Blueprint,10,1135000000,1,18000,1,Raven,Ships,Battleships,Standard Battleships,Caldari,
Scorpion Blueprint,Battleship Blueprint,10,1075000000,1,18000,1,Scorpion,Ships,Battleships,Standard Battleships,Caldari,
Megathron Blueprint,Battleship Blueprint,10,1250000000,1,18000,1,Megathron,Ships,Battleships,Standard Battleships,Gallente,
Dominix Blueprint,Battleship Blueprint,10,1660000000,1,18000,1,Dominix,Ships,Battleships,Standard Battleships,Gallente,
Hyperion Blueprint,Battleship Blueprint,10,1760000000,1,18000,1,Hyperion,Ships,Battleships,Standard Battleships,Gallente,
Maelstrom Blueprint,Battleship Blueprint,10,1450000000,1,18000,1,Maelstrom,Ships,Battleships,Standard Battleships,Minmatar,
Tempest Blueprint,Battleship Blueprint,10,1055000000,1,18000,1,Tempest,Ships,Battleships,Standard Battleships,Minmatar,
Typhoon Blueprint,Battleship Blueprint,10,975000000,1,18000,1,Typhoon,Ships,Battleships,Standard Battleships,Minmatar,
Rorqual Blueprint,Capital Industrial Ship Blueprint,1,3000000000,1,2000000,1,Rorqual,Ships,Capital Ships,Capital Industrial Ships,ORE,
Archon Blueprint,Carrier Blueprint,1,1100000000,1,2000000,1,Archon,Ships,Capital Ships,Carriers,Amarr,
Aeon Blueprint,Supercarrier Blueprints,1,18500000000,1,6000000,1,Aeon,Ships,Capital Ships,Carriers,Amarr,
Chimera Blueprint,Carrier Blueprint,1,1050000000,1,2000000,1,Chimera,Ships,Capital Ships,Carriers,Caldari,
Wyvern Blueprint,Supercarrier Blueprints,1,18000000000,1,6000000,1,Wyvern,Ships,Capital Ships,Carriers,Caldari,
Revenant Blueprint,Supercarrier Blueprints,1,18500000000,1,7800000,1,Revenant,Ships,Capital Ships,Carriers,Faction Carrier,
Vendetta Blueprint,Supercarrier Blueprints,1,NULL,1,7800000,1,Vendetta,Ships,Capital Ships,Carriers,Faction Carrier,
Thanatos Blueprint,Carrier Blueprint,1,1250000000,1,2000000,1,Thanatos,Ships,Capital Ships,Carriers,Gallente,
Nyx Blueprint,Supercarrier Blueprints,1,20000000000,1,6000000,1,Nyx,Ships,Capital Ships,Carriers,Gallente,
Nidhoggur Blueprint,Carrier Blueprint,1,1150000000,1,2000000,1,Nidhoggur,Ships,Capital Ships,Carriers,Minmatar,
Hel Blueprint,Supercarrier Blueprints,1,19000000000,1,6000000,1,Hel,Ships,Capital Ships,Carriers,Minmatar,
Revelation Blueprint,Dreadnought Blueprint,1,2000000000,1,2000000,1,Revelation,Ships,Capital Ships,Dreadnoughts,Amarr,
Phoenix Blueprint,Dreadnought Blueprint,1,1950000000,1,2000000,1,Phoenix,Ships,Capital Ships,Dreadnoughts,Caldari,
Vehement Blueprint,Dreadnought Blueprint,1,NULL,1,2600000,1,Vehement,Ships,Capital Ships,Dreadnoughts,Faction Dreadnoughts,
Chemosh Blueprint,Dreadnought Blueprint,1,NULL,1,2400000,1,Chemosh,Ships,Capital Ships,Dreadnoughts,Faction Dreadnoughts,
Caiman Blueprint,Dreadnought Blueprint,1,NULL,1,2000000,1,Caiman,Ships,Capital Ships,Dreadnoughts,Faction Dreadnoughts,
Moros Blueprint,Dreadnought Blueprint,1,1900000000,1,2000000,1,Moros,Ships,Capital Ships,Dreadnoughts,Gallente,
Naglfar Blueprint,Dreadnought Blueprint,1,1850000000,1,2000000,1,Naglfar,Ships,Capital Ships,Dreadnoughts,Minmatar,
Zirnitra Blueprint,Dreadnought Blueprint,1,2000000000,1,2000000,1,Zirnitra,Ships,Capital Ships,Dreadnoughts,Precursor Dreadnoughts,
Apostle Blueprint,Force Auxiliary Blueprint,1,1000000000,1,2000000,1,Apostle,Ships,Capital Ships,Force Auxiliaries,Amarr,
Minokawa Blueprint,Force Auxiliary Blueprint,1,1000000000,1,2000000,1,Minokawa,Ships,Capital Ships,Force Auxiliaries,Caldari,
Dagon Blueprint,Force Auxiliary Blueprint,1,NULL,1,2400000,1,Dagon,Ships,Capital Ships,Force Auxiliaries,Faction Force Auxiliaries,
Loggerhead Blueprint,Force Auxiliary Blueprint,1,NULL,1,2000000,1,Loggerhead,Ships,Capital Ships,Force Auxiliaries,Faction Force Auxiliaries,
Ninazu Blueprint,Force Auxiliary Blueprint,1,1000000000,1,2000000,1,Ninazu,Ships,Capital Ships,Force Auxiliaries,Gallente,
Lif Blueprint,Force Auxiliary Blueprint,1,1000000000,1,2000000,1,Lif,Ships,Capital Ships,Force Auxiliaries,Minmatar,
Providence Blueprint,Freighter Blueprint,1,1900000000,1,1500000,1,Providence,Ships,Capital Ships,Freighters,Amarr,
Charon Blueprint,Freighter Blueprint,1,2000000000,1,1500000,1,Charon,Ships,Capital Ships,Freighters,Caldari,
Obelisk Blueprint,Freighter Blueprint,1,1950000000,1,1500000,1,Obelisk,Ships,Capital Ships,Freighters,Gallente,
Fenrir Blueprint,Freighter Blueprint,1,1850000000,1,1500000,1,Fenrir,Ships,Capital Ships,Freighters,Minmatar,
Bowhead Blueprint,Freighter Blueprint,1,1550000000,1,1500000,1,Bowhead,Ships,Capital Ships,Freighters,ORE,
Ark Blueprint,Freighter Blueprint,1,1900000000,1,3600000,1,Ark,Ships,Capital Ships,Jump Freighters,Amarr,
Rhea Blueprint,Freighter Blueprint,1,2000000000,1,3600000,1,Rhea,Ships,Capital Ships,Jump Freighters,Caldari,
Anshar Blueprint,Freighter Blueprint,1,1950000000,1,3600000,1,Anshar,Ships,Capital Ships,Jump Freighters,Gallente,
Nomad Blueprint,Freighter Blueprint,1,1850000000,1,3600000,1,Nomad,Ships,Capital Ships,Jump Freighters,Minmatar,
Avatar Blueprint,Titan Blueprint,1,75000000000,1,9000000,1,Avatar,Ships,Capital Ships,Titans,Amarr,
Leviathan Blueprint,Titan Blueprint,1,70000000000,1,9000000,1,Leviathan,Ships,Capital Ships,Titans,Caldari,
Vanquisher Blueprint,Titan Blueprint,1,NULL,1,11700000,1,Vanquisher,Ships,Capital Ships,Titans,Faction Titans,
Molok Blueprint,Titan Blueprint,1,NULL,1,10800000,1,Molok,Ships,Capital Ships,Titans,Faction Titans,
Komodo Blueprint,Titan Blueprint,1,NULL,1,9000000,1,Komodo,Ships,Capital Ships,Titans,Faction Titans,
Erebus Blueprint,Titan Blueprint,1,72500000000,1,9000000,1,Erebus,Ships,Capital Ships,Titans,Gallente,
Ragnarok Blueprint,Titan Blueprint,1,67500000000,1,9000000,1,Ragnarok,Ships,Capital Ships,Titans,Minmatar,
Monitor Blueprint,Cruiser Blueprint,1,60000000,1,300000,1,Monitor,Ships,Cruisers,Advanced Cruisers,Flag Cruisers,CONCORD
