typeName,typeID,groupName,maxProductionLimit,basePrice,published,buildTime,outputQuantity,productName,productGroup4Name,productGroup3Name,productGroup2Name,productGroup1Name,productGroup0Name
"Medium Higgs Anchor I Blueprint",34269,"Rig Blueprint",60,750000.0000,1,3000,1,"Medium Higgs Anchor I",NULL,"Ship and Module Modifications",Rigs,"Astronautic Rigs","Medium Astronautic Rigs"
"Medium Auxiliary Thrusters I Blueprint",31108,"Rig Blueprint",60,750000.0000,1,3000,1,"Medium Auxiliary Thrusters I",NULL,"Ship and Module Modifications",Rigs,"Astronautic Rigs","Medium Astronautic Rigs"
"Medium Auxiliary Thrusters II Blueprint",31114,"Rig Blueprint",1,750000.0000,1,30000,1,"Medium Auxiliary Thrusters II",NULL,"Ship and Module Modifications",Rigs,"Astronautic Rigs","Medium Astronautic Rigs"
"Medium Cargohold Optimization I Blueprint",31120,"Rig Blueprint",60,750000.0000,1,3000,1,"Medium Cargohold Optimization I",NULL,"Ship and Module Modifications",Rigs,"Astronautic Rigs","Medium Astronautic Rigs"
"Medium Cargohold Optimization II Blueprint",31126,"Rig Blueprint",1,750000.0000,1,30000,1,"Medium Cargohold Optimization II",NULL,"Ship and Module Modifications",Rigs,"Astronautic Rigs","Medium Astronautic Rigs"
"Medium Dynamic Fuel Valve I Blueprint",31132,"Rig Blueprint",60,750000.0000,1,3000,1,"Medium Dynamic Fuel Valve I",NULL,"Ship and Module Modifications",Rigs,"Astronautic Rigs","Medium Astronautic Rigs"
"Medium Dynamic Fuel Valve II Blueprint",31138,"Rig Blueprint",1,750000.0000,1,30000,1,"Medium Dynamic Fuel Valve II",NULL,"Ship and Module Modifications",Rigs,"Astronautic Rigs","Medium Astronautic Rigs"
"Medium Engine Thermal Shielding I Blueprint",31144,"Rig Blueprint",60,750000.0000,1,3000,1,"Medium Engine Thermal Shielding I",NULL,"Ship and Module Modifications",Rigs,"Astronautic Rigs","Medium Astronautic Rigs"
"Medium Engine Thermal Shielding II Blueprint",31150,"Rig Blueprint",1,750000.0000,1,30000,1,"Medium Engine Thermal Shielding II",NULL,"Ship and Module Modifications",Rigs,"Astronautic Rigs","Medium Astronautic Rigs"
"Medium Low Friction Nozzle Joints I Blueprint",31156,"Rig Blueprint",60,750000.0000,1,3000,1,"Medium Low Friction Nozzle Joints I",NULL,"Ship and Module Modifications",Rigs,"Astronautic Rigs","Medium Astronautic Rigs"
"Medium Hyperspatial Velocity Optimizer I Blueprint",31162,"Rig Blueprint",60,750000.0000,1,3000,1,"Medium Hyperspatial Velocity Optimizer I",NULL,"Ship and Module Modifications",Rigs,"Astronautic Rigs","Medium Astronautic Rigs"
"Medium Hyperspatial Velocity Optimizer II Blueprint",31168,"Rig Blueprint",1,750000.0000,1,30000,1,"Medium Hyperspatial Velocity Optimizer II",NULL,"Ship and Module Modifications",Rigs,"Astronautic Rigs","Medium Astronautic Rigs"
"Medium Low Friction Nozzle Joints II Blueprint",31174,"Rig Blueprint",1,750000.0000,1,30000,1,"Medium Low Friction Nozzle Joints II",NULL,"Ship and Module Modifications",Rigs,"Astronautic Rigs","Medium Astronautic Rigs"
"Medium Polycarbon Engine Housing I Blueprint",31180,"Rig Blueprint",60,750000.0000,1,3000,1,"Medium Polycarbon Engine Housing I",NULL,"Ship and Module Modifications",Rigs,"Astronautic Rigs","Medium Astronautic Rigs"
"Medium Polycarbon Engine Housing II Blueprint",31186,"Rig Blueprint",1,750000.0000,1,30000,1,"Medium Polycarbon Engine Housing II",NULL,"Ship and Module Modifications",Rigs,"Astronautic Rigs","Medium Astronautic Rigs"
"Medium Warp Core Optimizer I Blueprint",31192,"Rig Blueprint",60,750000.0000,1,3000,1,"Medium Warp Core Optimizer I",NULL,"Ship and Module Modifications",Rigs,"Astronautic Rigs","Medium Astronautic Rigs"
"Medium Warp Core Optimizer II Blueprint",31198,"Rig Blueprint",1,750000.0000,1,30000,1,"Medium Warp Core Optimizer II",NULL,"Ship and Module Modifications",Rigs,"Astronautic Rigs","Medium Astronautic Rigs"
"Small Auxiliary Thrusters I Blueprint",31106,"Rig Blueprint",100,125000.0000,1,1500,1,"Small Auxiliary Thrusters I",NULL,"Ship and Module Modifications",Rigs,"Astronautic Rigs","Small Astronautic Rigs"
"Small Auxiliary Thrusters II Blueprint",31112,"Rig Blueprint",1,125000.0000,1,15000,1,"Small Auxiliary Thrusters II",NULL,"Ship and Module Modifications",Rigs,"Astronautic Rigs","Small Astronautic Rigs"
"Small Cargohold Optimization I Blueprint",31118,"Rig Blueprint",100,125000.0000,1,1500,1,"Small Cargohold Optimization I",NULL,"Ship and Module Modifications",Rigs,"Astronautic Rigs","Small Astronautic Rigs"
"Small Cargohold Optimization II Blueprint",31124,"Rig Blueprint",1,125000.0000,1,15000,1,"Small Cargohold Optimization II",NULL,"Ship and Module Modifications",Rigs,"Astronautic Rigs","Small Astronautic Rigs"
"Small Dynamic Fuel Valve I Blueprint",31130,"Rig Blueprint",100,125000.0000,1,1500,1,"Small Dynamic Fuel Valve I",NULL,"Ship and Module Modifications",Rigs,"Astronautic Rigs","Small Astronautic Rigs"
"Small Dynamic Fuel Valve II Blueprint",31136,"Rig Blueprint",1,125000.0000,1,15000,1,"Small Dynamic Fuel Valve II",NULL,"Ship and Module Modifications",Rigs,"Astronautic Rigs","Small Astronautic Rigs"
"Small Engine Thermal Shielding I Blueprint",31142,"Rig Blueprint",100,125000.0000,1,1500,1,"Small Engine Thermal Shielding I",NULL,"Ship and Module Modifications",Rigs,"Astronautic Rigs","Small Astronautic Rigs"
"Small Engine Thermal Shielding II Blueprint",31148,"Rig Blueprint",1,125000.0000,1,15000,1,"Small Engine Thermal Shielding II",NULL,"Ship and Module Modifications",Rigs,"Astronautic Rigs","Small Astronautic Rigs"
"Small Low Friction Nozzle Joints I Blueprint",31154,"Rig Blueprint",100,125000.0000,1,1500,1,"Small Low Friction Nozzle Joints I",NULL,"Ship and Module Modifications",Rigs,"Astronautic Rigs","Small Astronautic Rigs"
"Small Hyperspatial Velocity Optimizer I Blueprint",31160,"Rig Blueprint",100,125000.0000,1,1500,1,"Small Hyperspatial Velocity Optimizer I",NULL,"Ship and Module Modifications",Rigs,"Astronautic Rigs","Small Astronautic Rigs"
"Small Hyperspatial Velocity Optimizer II Blueprint",31166,"Rig Blueprint",1,125000.0000,1,15000,1,"Small Hyperspatial Velocity Optimizer II",NULL,"Ship and Module Modifications",Rigs,"Astronautic Rigs","Small Astronautic Rigs"
"Small Low Friction Nozzle Joints II Blueprint",31172,"Rig Blueprint",1,125000.0000,1,15000,1,"Small Low Friction Nozzle Joints II",NULL,"Ship and Module Modifications",Rigs,"Astronautic Rigs","Small Astronautic Rigs"
"Small Polycarbon Engine Housing I Blueprint",31178,"Rig Blueprint",100,125000.0000,1,1500,1,"Small Polycarbon Engine Housing I",NULL,"Ship and Module Modifications",Rigs,"Astronautic Rigs","Small Astronautic Rigs"
"Small Polycarbon Engine Housing II Blueprint",31184,"Rig Blueprint",1,125000.0000,1,15000,1,"Small Polycarbon Engine Housing II",NULL,"Ship and Module Modifications",Rigs,"Astronautic Rigs","Small Astronautic Rigs"
"Small Warp Core Optimizer I Blueprint",31190,"Rig Blueprint",100,125000.0000,1,1500,1,"Small Warp Core Optimizer I",NULL,"Ship and Module Modifications",Rigs,"Astronautic Rigs","Small Astronautic Rigs"
"Small Warp Core Optimizer II Blueprint",31196,"Rig Blueprint",1,125000.0000,1,15000,1,"Small Warp Core Optimizer II",NULL,"Ship and Module Modifications",Rigs,"Astronautic Rigs","Small Astronautic Rigs"
"Small Higgs Anchor I Blueprint",34267,"Rig Blueprint",100,125000.0000,1,1500,1,"Small Higgs Anchor I",NULL,"Ship and Module Modifications",Rigs,"Astronautic Rigs","Small Astronautic Rigs"
"Capital Drone Control Range Augmentor I Blueprint",33278,"Rig Blueprint",30,50000000.0000,1,6000,1,"Capital Drone Control Range Augmentor I",NULL,"Ship and Module Modifications",Rigs,"Drone Rigs","Capital Drone Rigs"
"Capital Drone Control Range Augmentor II Blueprint",33280,"Rig Blueprint",1,50000000.0000,1,60000,1,"Capital Drone Control Range Augmentor II",NULL,"Ship and Module Modifications",Rigs,"Drone Rigs","Capital Drone Rigs"
"Capital Drone Durability Enhancer I Blueprint",33282,"Rig Blueprint",30,50000000.0000,1,6000,1,"Capital Drone Durability Enhancer I",NULL,"Ship and Module Modifications",Rigs,"Drone Rigs","Capital Drone Rigs"
"Capital Drone Durability Enhancer II Blueprint",33284,"Rig Blueprint",1,50000000.0000,1,60000,1,"Capital Drone Durability Enhancer II",NULL,"Ship and Module Modifications",Rigs,"Drone Rigs","Capital Drone Rigs"
"Capital Drone Mining Augmentor I Blueprint",33286,"Rig Blueprint",30,50000000.0000,1,6000,1,"Capital Drone Mining Augmentor I",NULL,"Ship and Module Modifications",Rigs,"Drone Rigs","Capital Drone Rigs"
"Capital Drone Mining Augmentor II Blueprint",33288,"Rig Blueprint",1,50000000.0000,1,60000,1,"Capital Drone Mining Augmentor II",NULL,"Ship and Module Modifications",Rigs,"Drone Rigs","Capital Drone Rigs"
"Capital Drone Repair Augmentor I Blueprint",33290,"Rig Blueprint",30,50000000.0000,1,6000,1,"Capital Drone Repair Augmentor I",NULL,"Ship and Module Modifications",Rigs,"Drone Rigs","Capital Drone Rigs"
"Capital Drone Repair Augmentor II Blueprint",33292,"Rig Blueprint",1,50000000.0000,1,60000,1,"Capital Drone Repair Augmentor II",NULL,"Ship and Module Modifications",Rigs,"Drone Rigs","Capital Drone Rigs"
"Capital Drone Scope Chip I Blueprint",33294,"Rig Blueprint",30,50000000.0000,1,6000,1,"Capital Drone Scope Chip I",NULL,"Ship and Module Modifications",Rigs,"Drone Rigs","Capital Drone Rigs"
"Capital Drone Scope Chip II Blueprint",33296,"Rig Blueprint",1,50000000.0000,1,60000,1,"Capital Drone Scope Chip II",NULL,"Ship and Module Modifications",Rigs,"Drone Rigs","Capital Drone Rigs"
"Capital Drone Speed Augmentor I Blueprint",33299,"Rig Blueprint",30,50000000.0000,1,6000,1,"Capital Drone Speed Augmentor I",NULL,"Ship and Module Modifications",Rigs,"Drone Rigs","Capital Drone Rigs"
"Capital Drone Speed Augmentor II Blueprint",33300,"Rig Blueprint",1,50000000.0000,1,60000,1,"Capital Drone Speed Augmentor II",NULL,"Ship and Module Modifications",Rigs,"Drone Rigs","Capital Drone Rigs"
"Capital Sentry Damage Augmentor I Blueprint",33308,"Rig Blueprint",30,50000000.0000,1,6000,1,"Capital Sentry Damage Augmentor I",NULL,"Ship and Module Modifications",Rigs,"Drone Rigs","Capital Drone Rigs"
"Capital Sentry Damage Augmentor II Blueprint",33310,"Rig Blueprint",1,50000000.0000,1,60000,1,"Capital Sentry Damage Augmentor II",NULL,"Ship and Module Modifications",Rigs,"Drone Rigs","Capital Drone Rigs"
"Capital Stasis Drone Augmentor I Blueprint",33312,"Rig Blueprint",30,50000000.0000,1,6000,1,"Capital Stasis Drone Augmentor I",NULL,"Ship and Module Modifications",Rigs,"Drone Rigs","Capital Drone Rigs"
"Capital Stasis Drone Augmentor II Blueprint",33314,"Rig Blueprint",1,50000000.0000,1,60000,1,"Capital Stasis Drone Augmentor II",NULL,"Ship and Module Modifications",Rigs,"Drone Rigs","Capital Drone Rigs"
"Large Drone Control Range Augmentor II Blueprint",26325,"Rig Blueprint",1,1250000.0000,1,45000,1,"Large Drone Control Range Augmentor II",NULL,"Ship and Module Modifications",Rigs,"Drone Rigs","Large Drone Rigs"
"Large Drone Durability Enhancer II Blueprint",26327,"Rig Blueprint",1,1250000.0000,1,45000,1,"Large Drone Durability Enhancer II",NULL,"Ship and Module Modifications",Rigs,"Drone Rigs","Large Drone Rigs"
"Large Drone Mining Augmentor II Blueprint",26329,"Rig Blueprint",1,1250000.0000,1,45000,1,"Large Drone Mining Augmentor II",NULL,"Ship and Module Modifications",Rigs,"Drone Rigs","Large Drone Rigs"
"Large Drone Repair Augmentor II Blueprint",26331,"Rig Blueprint",1,1250000.0000,1,45000,1,"Large Drone Repair Augmentor II",NULL,"Ship and Module Modifications",Rigs,"Drone Rigs","Large Drone Rigs"
"Large Drone Scope Chip II Blueprint",26333,"Rig Blueprint",1,1250000.0000,1,45000,1,"Large Drone Scope Chip II",NULL,"Ship and Module Modifications",Rigs,"Drone Rigs","Large Drone Rigs"
"Large Drone Speed Augmentor II Blueprint",26335,"Rig Blueprint",1,1250000.0000,1,45000,1,"Large Drone Speed Augmentor II",NULL,"Ship and Module Modifications",Rigs,"Drone Rigs","Large Drone Rigs"
"Large Sentry Damage Augmentor II Blueprint",26339,"Rig Blueprint",1,1250000.0000,1,45000,1,"Large Sentry Damage Augmentor II",NULL,"Ship and Module Modifications",Rigs,"Drone Rigs","Large Drone Rigs"
"Large Stasis Drone Augmentor II Blueprint",26341,"Rig Blueprint",1,1250000.0000,1,45000,1,"Large Stasis Drone Augmentor II",NULL,"Ship and Module Modifications",Rigs,"Drone Rigs","Large Drone Rigs"
"Large Drone Control Range Augmentor I Blueprint",25909,"Rig Blueprint",40,1250000.0000,1,4500,1,"Large Drone Control Range Augmentor I",NULL,"Ship and Module Modifications",Rigs,"Drone Rigs","Large Drone Rigs"
"Large Drone Repair Augmentor I Blueprint",25911,"Rig Blueprint",40,1250000.0000,1,4500,1,"Large Drone Repair Augmentor I",NULL,"Ship and Module Modifications",Rigs,"Drone Rigs","Large Drone Rigs"
"Large Drone Scope Chip I Blueprint",25913,"Rig Blueprint",40,1250000.0000,1,4500,1,"Large Drone Scope Chip I",NULL,"Ship and Module Modifications",Rigs,"Drone Rigs","Large Drone Rigs"
"Large Drone Speed Augmentor I Blueprint",25915,"Rig Blueprint",40,1250000.0000,1,4500,1,"Large Drone Speed Augmentor I",NULL,"Ship and Module Modifications",Rigs,"Drone Rigs","Large Drone Rigs"
"Large Drone Durability Enhancer I Blueprint",25917,"Rig Blueprint",40,1250000.0000,1,4500,1,"Large Drone Durability Enhancer I",NULL,"Ship and Module Modifications",Rigs,"Drone Rigs","Large Drone Rigs"
"Large Drone Mining Augmentor I Blueprint",25919,"Rig Blueprint",40,1250000.0000,1,4500,1,"Large Drone Mining Augmentor I",NULL,"Ship and Module Modifications",Rigs,"Drone Rigs","Large Drone Rigs"
"Large Sentry Damage Augmentor I Blueprint",25921,"Rig Blueprint",40,1250000.0000,1,4500,1,"Large Sentry Damage Augmentor I",NULL,"Ship and Module Modifications",Rigs,"Drone Rigs","Large Drone Rigs"
"Large Stasis Drone Augmentor I Blueprint",25925,"Rig Blueprint",40,1250000.0000,1,4500,1,"Large Stasis Drone Augmentor I",NULL,"Ship and Module Modifications",Rigs,"Drone Rigs","Large Drone Rigs"
"Medium Drone Control Range Augmentor I Blueprint",32028,"Rig Blueprint",60,750000.0000,1,3000,1,"Medium Drone Control Range Augmentor I",NULL,"Ship and Module Modifications",Rigs,"Drone Rigs","Medium Drone Rigs"
"Medium Drone Control Range Augmentor II Blueprint",32032,"Rig Blueprint",1,750000.0000,1,30000,1,"Medium Drone Control Range Augmentor II",NULL,"Ship and Module Modifications",Rigs,"Drone Rigs","Medium Drone Rigs"
"Medium Drone Durability Enhancer I Blueprint",32036,"Rig Blueprint",60,750000.0000,1,3000,1,"Medium Drone Durability Enhancer I",NULL,"Ship and Module Modifications",Rigs,"Drone Rigs","Medium Drone Rigs"
"Medium Drone Durability Enhancer II Blueprint",32040,"Rig Blueprint",1,750000.0000,1,30000,1,"Medium Drone Durability Enhancer II",NULL,"Ship and Module Modifications",Rigs,"Drone Rigs","Medium Drone Rigs"
"Medium Drone Mining Augmentor I Blueprint",32044,"Rig Blueprint",60,750000.0000,1,3000,1,"Medium Drone Mining Augmentor I",NULL,"Ship and Module Modifications",Rigs,"Drone Rigs","Medium Drone Rigs"
"Medium Drone Mining Augmentor II Blueprint",32048,"Rig Blueprint",1,750000.0000,1,30000,1,"Medium Drone Mining Augmentor II",NULL,"Ship and Module Modifications",Rigs,"Drone Rigs","Medium Drone Rigs"
"Medium Drone Repair Augmentor I Blueprint",32052,"Rig Blueprint",60,750000.0000,1,3000,1,"Medium Drone Repair Augmentor I",NULL,"Ship and Module Modifications",Rigs,"Drone Rigs","Medium Drone Rigs"
"Medium Drone Repair Augmentor II Blueprint",32056,"Rig Blueprint",1,750000.0000,1,30000,1,"Medium Drone Repair Augmentor II",NULL,"Ship and Module Modifications",Rigs,"Drone Rigs","Medium Drone Rigs"
"Medium Drone Speed Augmentor I Blueprint",32060,"Rig Blueprint",60,750000.0000,1,3000,1,"Medium Drone Speed Augmentor I",NULL,"Ship and Module Modifications",Rigs,"Drone Rigs","Medium Drone Rigs"
"Medium Drone Speed Augmentor II Blueprint",32064,"Rig Blueprint",1,750000.0000,1,30000,1,"Medium Drone Speed Augmentor II",NULL,"Ship and Module Modifications",Rigs,"Drone Rigs","Medium Drone Rigs"
"Medium Drone Scope Chip I Blueprint",32072,"Rig Blueprint",60,750000.0000,1,3000,1,"Medium Drone Scope Chip I",NULL,"Ship and Module Modifications",Rigs,"Drone Rigs","Medium Drone Rigs"
"Medium Drone Scope Chip II Blueprint",32076,"Rig Blueprint",1,750000.0000,1,30000,1,"Medium Drone Scope Chip II",NULL,"Ship and Module Modifications",Rigs,"Drone Rigs","Medium Drone Rigs"
"Medium Sentry Damage Augmentor I Blueprint",32084,"Rig Blueprint",60,750000.0000,1,3000,1,"Medium Sentry Damage Augmentor I",NULL,"Ship and Module Modifications",Rigs,"Drone Rigs","Medium Drone Rigs"
"Medium Sentry Damage Augmentor II Blueprint",32088,"Rig Blueprint",1,750000.0000,1,30000,1,"Medium Sentry Damage Augmentor II",NULL,"Ship and Module Modifications",Rigs,"Drone Rigs","Medium Drone Rigs"
"Medium Stasis Drone Augmentor I Blueprint",32092,"Rig Blueprint",60,750000.0000,1,3000,1,"Medium Stasis Drone Augmentor I",NULL,"Ship and Module Modifications",Rigs,"Drone Rigs","Medium Drone Rigs"
"Medium Stasis Drone Augmentor II Blueprint",32096,"Rig Blueprint",1,750000.0000,1,30000,1,"Medium Stasis Drone Augmentor II",NULL,"Ship and Module Modifications",Rigs,"Drone Rigs","Medium Drone Rigs"
"Small Drone Durability Enhancer I Blueprint",32034,"Rig Blueprint",100,125000.0000,1,1500,1,"Small Drone Durability Enhancer I",NULL,"Ship and Module Modifications",Rigs,"Drone Rigs","Small Drone Rigs"
"Small Drone Durability Enhancer II Blueprint",32038,"Rig Blueprint",1,125000.0000,1,15000,1,"Small Drone Durability Enhancer II",NULL,"Ship and Module Modifications",Rigs,"Drone Rigs","Small Drone Rigs"
"Small Drone Mining Augmentor I Blueprint",32042,"Rig Blueprint",100,125000.0000,1,1500,1,"Small Drone Mining Augmentor I",NULL,"Ship and Module Modifications",Rigs,"Drone Rigs","Small Drone Rigs"
"Small Drone Mining Augmentor II Blueprint",32046,"Rig Blueprint",1,125000.0000,1,15000,1,"Small Drone Mining Augmentor II",NULL,"Ship and Module Modifications",Rigs,"Drone Rigs","Small Drone Rigs"
"Small Drone Repair Augmentor I Blueprint",32050,"Rig Blueprint",100,125000.0000,1,1500,1,"Small Drone Repair Augmentor I",NULL,"Ship and Module Modifications",Rigs,"Drone Rigs","Small Drone Rigs"
"Small Drone Repair Augmentor II Blueprint",32054,"Rig Blueprint",1,125000.0000,1,15000,1,"Small Drone Repair Augmentor II",NULL,"Ship and Module Modifications",Rigs,"Drone Rigs","Small Drone Rigs"
"Small Drone Speed Augmentor I Blueprint",32058,"Rig Blueprint",100,125000.0000,1,1500,1,"Small Drone Speed Augmentor I",NULL,"Ship and Module Modifications",Rigs,"Drone Rigs","Small Drone Rigs"
"Small Drone Speed Augmentor II Blueprint",32062,"Rig Blueprint",1,125000.0000,1,15000,1,"Small Drone Speed Augmentor II",NULL,"Ship and Module Modifications",Rigs,"Drone Rigs","Small Drone Rigs"
"Small Drone Scope Chip I Blueprint",32070,"Rig Blueprint",100,125000.0000,1,1500,1,"Small Drone Scope Chip I",NULL,"Ship and Module Modifications",Rigs,"Drone Rigs","Small Drone Rigs"
"Small Drone Scope Chip II Blueprint",32074,"Rig Blueprint",1,125000.0000,1,15000,1,"Small Drone Scope Chip II",NULL,"Ship and Module Modifications",Rigs,"Drone Rigs","Small Drone Rigs"
"Small Sentry Damage Augmentor I Blueprint",32082,"Rig Blueprint",100,125000.0000,1,1500,1,"Small Sentry Damage Augmentor I",NULL,"Ship and Module Modifications",Rigs,"Drone Rigs","Small Drone Rigs"
"Small Sentry Damage Augmentor II Blueprint",32086,"Rig Blueprint",1,125000.0000,1,15000,1,"Small Sentry Damage Augmentor II",NULL,"Ship and Module Modifications",Rigs,"Drone Rigs","Small Drone Rigs"
"Small Stasis Drone Augmentor I Blueprint",32090,"Rig Blueprint",100,125000.0000,1,1500,1,"Small Stasis Drone Augmentor I",NULL,"Ship and Module Modifications",Rigs,"Drone Rigs","Small Drone Rigs"
"Small Stasis Drone Augmentor II Blueprint",32094,"Rig Blueprint",1,125000.0000,1,15000,1,"Small Stasis Drone Augmentor II",NULL,"Ship and Module Modifications",Rigs,"Drone Rigs","Small Drone Rigs"
"Small Drone Control Range Augmentor I Blueprint",32026,"Rig Blueprint",100,125000.0000,1,1500,1,"Small Drone Control Range Augmentor I",NULL,"Ship and Module Modifications",Rigs,"Drone Rigs","Small Drone Rigs"
"Small Drone Control Range Augmentor II Blueprint",32030,"Rig Blueprint",1,125000.0000,1,15000,1,"Small Drone Control Range Augmentor II",NULL,"Ship and Module Modifications",Rigs,"Drone Rigs","Small Drone Rigs"
"Capital Signal Disruption Amplifier I Blueprint",31255,"Rig Blueprint",30,50000000.0000,1,6000,1,"Capital Signal Disruption Amplifier I",NULL,"Ship and Module Modifications",Rigs,"Electronics Superiority Rigs","Capital Electronics Superiority Rigs"
"Capital Signal Disruption Amplifier II Blueprint",31261,"Rig Blueprint",1,50000000.0000,1,60000,1,"Capital Signal Disruption Amplifier II",NULL,"Ship and Module Modifications",Rigs,"Electronics Superiority Rigs","Capital Electronics Superiority Rigs"
"Capital Inverted Signal Field Projector I Blueprint",31267,"Rig Blueprint",30,50000000.0000,1,6000,1,"Capital Inverted Signal Field Projector I",NULL,"Ship and Module Modifications",Rigs,"Electronics Superiority Rigs","Capital Electronics Superiority Rigs"
"Capital Inverted Signal Field Projector II Blueprint",31273,"Rig Blueprint",1,50000000.0000,1,60000,1,"Capital Inverted Signal Field Projector II",NULL,"Ship and Module Modifications",Rigs,"Electronics Superiority Rigs","Capital Electronics Superiority Rigs"
"Capital Particle Dispersion Augmentor I Blueprint",31291,"Rig Blueprint",30,50000000.0000,1,6000,1,"Capital Particle Dispersion Augmentor I",NULL,"Ship and Module Modifications",Rigs,"Electronics Superiority Rigs","Capital Electronics Superiority Rigs"
"Capital Particle Dispersion Augmentor II Blueprint",31297,"Rig Blueprint",1,50000000.0000,1,60000,1,"Capital Particle Dispersion Augmentor II",NULL,"Ship and Module Modifications",Rigs,"Electronics Superiority Rigs","Capital Electronics Superiority Rigs"
"Capital Particle Dispersion Projector I Blueprint",31303,"Rig Blueprint",30,50000000.0000,1,6000,1,"Capital Particle Dispersion Projector I",NULL,"Ship and Module Modifications",Rigs,"Electronics Superiority Rigs","Capital Electronics Superiority Rigs"
"Capital Particle Dispersion Projector II Blueprint",31309,"Rig Blueprint",1,50000000.0000,1,60000,1,"Capital Particle Dispersion Projector II",NULL,"Ship and Module Modifications",Rigs,"Electronics Superiority Rigs","Capital Electronics Superiority Rigs"
"Capital Targeting Systems Stabilizer I Blueprint",31339,"Rig Blueprint",30,50000000.0000,1,6000,1,"Capital Targeting Systems Stabilizer I",NULL,"Ship and Module Modifications",Rigs,"Electronics Superiority Rigs","Capital Electronics Superiority Rigs"
"Capital Targeting Systems Stabilizer II Blueprint",31345,"Rig Blueprint",1,50000000.0000,1,60000,1,"Capital Targeting Systems Stabilizer II",NULL,"Ship and Module Modifications",Rigs,"Electronics Superiority Rigs","Capital Electronics Superiority Rigs"
"Capital Tracking Diagnostic Subroutines I Blueprint",31351,"Rig Blueprint",30,50000000.0000,1,6000,1,"Capital Tracking Diagnostic Subroutines I",NULL,"Ship and Module Modifications",Rigs,"Electronics Superiority Rigs","Capital Electronics Superiority Rigs"
"Capital Tracking Diagnostic Subroutines II Blueprint",31357,"Rig Blueprint",1,50000000.0000,1,60000,1,"Capital Tracking Diagnostic Subroutines II",NULL,"Ship and Module Modifications",Rigs,"Electronics Superiority Rigs","Capital Electronics Superiority Rigs"
"Large Targeting Systems Stabilizer I Blueprint",26097,"Rig Blueprint",40,1250000.0000,1,4500,1,"Large Targeting Systems Stabilizer I",NULL,"Ship and Module Modifications",Rigs,"Electronics Superiority Rigs","Large Electronics Superiority Rigs"
"Large Particle Dispersion Augmentor I Blueprint",26107,"Rig Blueprint",40,1250000.0000,1,4500,1,"Large Particle Dispersion Augmentor I",NULL,"Ship and Module Modifications",Rigs,"Electronics Superiority Rigs","Large Electronics Superiority Rigs"
"Large Particle Dispersion Projector I Blueprint",26109,"Rig Blueprint",40,1250000.0000,1,4500,1,"Large Particle Dispersion Projector I",NULL,"Ship and Module Modifications",Rigs,"Electronics Superiority Rigs","Large Electronics Superiority Rigs"
"Large Inverted Signal Field Projector I Blueprint",26111,"Rig Blueprint",40,1250000.0000,1,4500,1,"Large Inverted Signal Field Projector I",NULL,"Ship and Module Modifications",Rigs,"Electronics Superiority Rigs","Large Electronics Superiority Rigs"
"Large Tracking Diagnostic Subroutines I Blueprint",26113,"Rig Blueprint",40,1250000.0000,1,4500,1,"Large Tracking Diagnostic Subroutines I",NULL,"Ship and Module Modifications",Rigs,"Electronics Superiority Rigs","Large Electronics Superiority Rigs"
"Large Signal Disruption Amplifier II Blueprint",26345,"Rig Blueprint",1,1250000.0000,1,45000,1,"Large Signal Disruption Amplifier II",NULL,"Ship and Module Modifications",Rigs,"Electronics Superiority Rigs","Large Electronics Superiority Rigs"
"Large Particle Dispersion Augmentor II Blueprint",26353,"Rig Blueprint",1,1250000.0000,1,45000,1,"Large Particle Dispersion Augmentor II",NULL,"Ship and Module Modifications",Rigs,"Electronics Superiority Rigs","Large Electronics Superiority Rigs"
"Large Inverted Signal Field Projector II Blueprint",26355,"Rig Blueprint",1,1250000.0000,1,45000,1,"Large Inverted Signal Field Projector II",NULL,"Ship and Module Modifications",Rigs,"Electronics Superiority Rigs","Large Electronics Superiority Rigs"
"Large Tracking Diagnostic Subroutines II Blueprint",26357,"Rig Blueprint",1,1250000.0000,1,45000,1,"Large Tracking Diagnostic Subroutines II",NULL,"Ship and Module Modifications",Rigs,"Electronics Superiority Rigs","Large Electronics Superiority Rigs"
"Large Particle Dispersion Projector II Blueprint",26361,"Rig Blueprint",1,1250000.0000,1,45000,1,"Large Particle Dispersion Projector II",NULL,"Ship and Module Modifications",Rigs,"Electronics Superiority Rigs","Large Electronics Superiority Rigs"
