typeName,typeID,groupName,maxProductionLimit,basePrice,published,buildTime,outputQuantity,productName,productGroup4Name,productGroup3Name,productGroup2Name,productGroup1Name,productGroup0Name
"Khanid Navy Explosive Energized Membrane Blueprint",28539,"Armor Coating Blueprint",200,NULL,1,900,1,"Khanid Navy Explosive Energized Membrane",NULL,"Ship Equipment","Hull & Armor ","Energized Armor Resistance Membranes","Explosive Energized Membranes"
"'Bribe' Explosive Energized Membrane Blueprint",55863,"Armor Coating Blueprint",200,NULL,1,900,1,"'Bribe' Explosive Energized Membrane",NULL,"Ship Equipment","Hull & Armor ","Energized Armor Resistance Membranes","Explosive Energized Membranes"
"Imperial Navy Kinetic Energized Membrane Blueprint",15728,"Armor Coating Blueprint",200,NULL,1,900,1,"Imperial Navy Kinetic Energized Membrane",NULL,"Ship Equipment","Hull & Armor ","Energized Armor Resistance Membranes","Kinetic Energized Membranes"
"Federation Navy Kinetic Energized Membrane Blueprint",15738,"Armor Coating Blueprint",200,NULL,1,900,1,"Federation Navy Kinetic Energized Membrane",NULL,"Ship Equipment","Hull & Armor ","Energized Armor Resistance Membranes","Kinetic Energized Membranes"
"'Mafia' Kinetic Energized Membrane Blueprint",22884,"Armor Coating Blueprint",200,NULL,1,900,1,"'Mafia' Kinetic Energized Membrane",NULL,"Ship Equipment","Hull & Armor ","Energized Armor Resistance Membranes","Kinetic Energized Membranes"
"'Basic' Kinetic Energized Membrane Blueprint",11246,"Armor Coating Blueprint",200,300000.0000,1,900,1,"'Basic' Kinetic Energized Membrane",NULL,"Ship Equipment","Hull & Armor ","Energized Armor Resistance Membranes","Kinetic Energized Membranes"
"Kinetic Energized Membrane I Blueprint",11248,"Armor Coating Blueprint",200,750000.0000,1,900,1,"Kinetic Energized Membrane I",NULL,"Ship Equipment","Hull & Armor ","Energized Armor Resistance Membranes","Kinetic Energized Membranes"
"Kinetic Energized Membrane II Blueprint",11250,"Armor Coating Blueprint",10,10000000000.0000,1,2340,1,"Kinetic Energized Membrane II",NULL,"Ship Equipment","Hull & Armor ","Energized Armor Resistance Membranes","Kinetic Energized Membranes"
"Ammatar Navy Kinetic Energized Membrane Blueprint",17539,"Armor Coating Blueprint",200,NULL,1,900,1,"Ammatar Navy Kinetic Energized Membrane",NULL,"Ship Equipment","Hull & Armor ","Energized Armor Resistance Membranes","Kinetic Energized Membranes"
"Khanid Navy Kinetic Energized Membrane Blueprint",28537,"Armor Coating Blueprint",200,NULL,1,900,1,"Khanid Navy Kinetic Energized Membrane",NULL,"Ship Equipment","Hull & Armor ","Energized Armor Resistance Membranes","Kinetic Energized Membranes"
"Khanid Navy Multispectrum Energized Membrane Blueprint",28535,"Armor Coating Blueprint",200,NULL,1,900,1,"Khanid Navy Multispectrum Energized Membrane",NULL,"Ship Equipment","Hull & Armor ","Energized Armor Resistance Membranes","Multispectrum Energized Membranes"
"Ammatar Navy Multispectrum Energized Membrane Blueprint",17537,"Armor Coating Blueprint",200,NULL,1,900,1,"Ammatar Navy Multispectrum Energized Membrane",NULL,"Ship Equipment","Hull & Armor ","Energized Armor Resistance Membranes","Multispectrum Energized Membranes"
"Imperial Navy Multispectrum Energized Membrane Blueprint",15730,"Armor Coating Blueprint",200,NULL,1,900,1,"Imperial Navy Multispectrum Energized Membrane",NULL,"Ship Equipment","Hull & Armor ","Energized Armor Resistance Membranes","Multispectrum Energized Membranes"
"Federation Navy Multispectrum Energized Membrane Blueprint",15740,"Armor Coating Blueprint",200,NULL,1,900,1,"Federation Navy Multispectrum Energized Membrane",NULL,"Ship Equipment","Hull & Armor ","Energized Armor Resistance Membranes","Multispectrum Energized Membranes"
"'Basic' Multispectrum Energized Membrane Blueprint",11266,"Armor Coating Blueprint",200,500000.0000,1,900,1,"'Basic' Multispectrum Energized Membrane",NULL,"Ship Equipment","Hull & Armor ","Energized Armor Resistance Membranes","Multispectrum Energized Membranes"
"Multispectrum Energized Membrane I Blueprint",11268,"Armor Coating Blueprint",200,1000000.0000,1,900,1,"Multispectrum Energized Membrane I",NULL,"Ship Equipment","Hull & Armor ","Energized Armor Resistance Membranes","Multispectrum Energized Membranes"
"Multispectrum Energized Membrane II Blueprint",11270,"Armor Coating Blueprint",10,10000000000.0000,1,2340,1,"Multispectrum Energized Membrane II",NULL,"Ship Equipment","Hull & Armor ","Energized Armor Resistance Membranes","Multispectrum Energized Membranes"
"'Pilfer' Multispectrum Energized Membrane Blueprint",22880,"Armor Coating Blueprint",200,NULL,1,900,1,"'Pilfer' Multispectrum Energized Membrane",NULL,"Ship Equipment","Hull & Armor ","Energized Armor Resistance Membranes","Multispectrum Energized Membranes"
"'Moonshine' Thermal Energized Membrane Blueprint",22882,"Armor Coating Blueprint",200,NULL,1,900,1,"'Moonshine' Thermal Energized Membrane",NULL,"Ship Equipment","Hull & Armor ","Energized Armor Resistance Membranes","Thermal Energized Membranes"
"Ammatar Navy Thermal Energized Membrane Blueprint",17545,"Armor Coating Blueprint",200,NULL,1,900,1,"Ammatar Navy Thermal Energized Membrane",NULL,"Ship Equipment","Hull & Armor ","Energized Armor Resistance Membranes","Thermal Energized Membranes"
"'Basic' Thermal Energized Membrane Blueprint",11256,"Armor Coating Blueprint",200,300000.0000,1,900,1,"'Basic' Thermal Energized Membrane",NULL,"Ship Equipment","Hull & Armor ","Energized Armor Resistance Membranes","Thermal Energized Membranes"
"Thermal Energized Membrane I Blueprint",11258,"Armor Coating Blueprint",200,750000.0000,1,900,1,"Thermal Energized Membrane I",NULL,"Ship Equipment","Hull & Armor ","Energized Armor Resistance Membranes","Thermal Energized Membranes"
"Thermal Energized Membrane II Blueprint",11260,"Armor Coating Blueprint",10,10000000000.0000,1,2340,1,"Thermal Energized Membrane II",NULL,"Ship Equipment","Hull & Armor ","Energized Armor Resistance Membranes","Thermal Energized Membranes"
"Imperial Navy Thermal Energized Membrane Blueprint",15722,"Armor Coating Blueprint",200,NULL,1,900,1,"Imperial Navy Thermal Energized Membrane",NULL,"Ship Equipment","Hull & Armor ","Energized Armor Resistance Membranes","Thermal Energized Membranes"
"Federation Navy Thermal Energized Membrane Blueprint",15732,"Armor Coating Blueprint",200,NULL,1,900,1,"Federation Navy Thermal Energized Membrane",NULL,"Ship Equipment","Hull & Armor ","Energized Armor Resistance Membranes","Thermal Energized Membranes"
"Khanid Navy Thermal Energized Membrane Blueprint",28543,"Armor Coating Blueprint",200,NULL,1,900,1,"Khanid Navy Thermal Energized Membrane",NULL,"Ship Equipment","Hull & Armor ","Energized Armor Resistance Membranes","Thermal Energized Membranes"
"Capital Hull Repairer I Blueprint",41627,"Hull Repair Unit Blueprint",5,9250000.0000,1,36000,1,"Capital Hull Repairer I",NULL,"Ship Equipment","Hull & Armor ","Hull Repairers",Capital
"Capital I-b Enduring Hull Repairer Blueprint",41628,"Hull Repair Unit Blueprint",5,18500000.0000,1,36000,1,"Capital I-b Enduring Hull Repairer",NULL,"Ship Equipment","Hull & Armor ","Hull Repairers",Capital
"Capital IEF Compact Hull Repairer Blueprint",41629,"Hull Repair Unit Blueprint",5,18500000.0000,1,36000,1,"Capital IEF Compact Hull Repairer",NULL,"Ship Equipment","Hull & Armor ","Hull Repairers",Capital
"Capital Hull Repairer II Blueprint",41630,"Hull Repair Unit Blueprint",5,NULL,1,36000,1,"Capital Hull Repairer II",NULL,"Ship Equipment","Hull & Armor ","Hull Repairers",Capital
"Large 'Integrative' Hull Repair Unit Blueprint",21509,"Hull Repair Unit Blueprint",100,NULL,1,1800,1,"Large 'Integrative' Hull Repair Unit",NULL,"Ship Equipment","Hull & Armor ","Hull Repairers",Large
"Large Hull Repairer I Blueprint",3664,"Hull Repair Unit Blueprint",100,3125000.0000,1,1800,1,"Large Hull Repairer I",NULL,"Ship Equipment","Hull & Armor ","Hull Repairers",Large
"Large Hull Repairer II Blueprint",3666,"Hull Repair Unit Blueprint",10,9999999.0000,1,4680,1,"Large Hull Repairer II",NULL,"Ship Equipment","Hull & Armor ","Hull Repairers",Large
"Medium Hull Repairer I Blueprint",3654,"Hull Repair Unit Blueprint",100,1250000.0000,1,1800,1,"Medium Hull Repairer I",NULL,"Ship Equipment","Hull & Armor ","Hull Repairers",Medium
"Medium Hull Repairer II Blueprint",3656,"Hull Repair Unit Blueprint",10,9999999.0000,1,4680,1,"Medium Hull Repairer II",NULL,"Ship Equipment","Hull & Armor ","Hull Repairers",Medium
"Medium 'Integrative' Hull Repair Unit Blueprint",21507,"Hull Repair Unit Blueprint",100,NULL,1,1800,1,"Medium 'Integrative' Hull Repair Unit",NULL,"Ship Equipment","Hull & Armor ","Hull Repairers",Medium
"Small 'Integrative' Hull Repair Unit Blueprint",21505,"Hull Repair Unit Blueprint",200,NULL,1,900,1,"Small 'Integrative' Hull Repair Unit",NULL,"Ship Equipment","Hull & Armor ","Hull Repairers",Small
"Small Hull Repairer I Blueprint",1100,"Hull Repair Unit Blueprint",200,499980.0000,1,900,1,"Small Hull Repairer I",NULL,"Ship Equipment","Hull & Armor ","Hull Repairers",Small
"Small Hull Repairer II Blueprint",2356,"Hull Repair Unit Blueprint",10,9999999.0000,1,2340,1,"Small Hull Repairer II",NULL,"Ship Equipment","Hull & Armor ","Hull Repairers",Small
"Expanded Cargohold I Blueprint",1318,"Hull Mods Blueprint",200,16640.0000,1,900,1,"Expanded Cargohold I",NULL,"Ship Equipment","Hull & Armor ","Hull Upgrades","Expanded Cargoholds"
"Expanded Cargohold II Blueprint",1320,"Hull Mods Blueprint",10,10000000000.0000,1,2340,1,"Expanded Cargohold II",NULL,"Ship Equipment","Hull & Armor ","Hull Upgrades","Expanded Cargoholds"
"Limited Expanded 'Archiver' Cargo Blueprint",21494,"Hull Mods Blueprint",200,NULL,1,900,1,"Limited Expanded 'Archiver' Cargo",NULL,"Ship Equipment","Hull & Armor ","Hull Upgrades","Expanded Cargoholds"
"Civilian Expanded Cargohold Blueprint",21856,"Hull Mods Blueprint",600,NULL,1,300,1,"Civilian Expanded Cargohold",NULL,"Ship Equipment","Hull & Armor ","Hull Upgrades","Expanded Cargoholds"
"Synthetic Hull Conversion Nanofiber Structure Blueprint",21501,"Hull Mods Blueprint",200,NULL,1,900,1,"Synthetic Hull Conversion Nanofiber Structure",NULL,"Ship Equipment","Hull & Armor ","Hull Upgrades","Nanofiber Internal Structures"
"Nanofiber Internal Structure I Blueprint",2604,"Hull Mods Blueprint",200,16640.0000,1,900,1,"Nanofiber Internal Structure I",NULL,"Ship Equipment","Hull & Armor ","Hull Upgrades","Nanofiber Internal Structures"
"Nanofiber Internal Structure II Blueprint",2606,"Hull Mods Blueprint",10,10000000000.0000,1,2340,1,"Nanofiber Internal Structure II",NULL,"Ship Equipment","Hull & Armor ","Hull Upgrades","Nanofiber Internal Structures"
"Reinforced Bulkheads I Blueprint",1334,"Hull Mods Blueprint",200,125000.0000,1,900,1,"Reinforced Bulkheads I",NULL,"Ship Equipment","Hull & Armor ","Hull Upgrades","Reinforced Bulkheads"
"Reinforced Bulkheads II Blueprint",1336,"Hull Mods Blueprint",10,9999999.0000,1,2340,1,"Reinforced Bulkheads II",NULL,"Ship Equipment","Hull & Armor ","Hull Upgrades","Reinforced Bulkheads"
"Synthetic Hull Conversion Reinforced Bulkheads Blueprint",21497,"Hull Mods Blueprint",200,NULL,1,900,1,"Synthetic Hull Conversion Reinforced Bulkheads",NULL,"Ship Equipment","Hull & Armor ","Hull Upgrades","Reinforced Bulkheads"
"Heavy Mutadaptive Remote Armor Repairer I Blueprint",49775,"Mutadaptive Remote Armor Repairer Blueprint",100,124700.0000,1,1800,1,"Heavy Mutadaptive Remote Armor Repairer I",NULL,"Ship Equipment","Hull & Armor ","Mutadaptive Remote Armor Repairers",Medium
"Heavy Mutadaptive Scoped Remote Armor Repairer Blueprint",49776,"Mutadaptive Remote Armor Repairer Blueprint",100,124700.0000,1,1800,1,"Heavy Mutadaptive Scoped Remote Armor Repairer",NULL,"Ship Equipment","Hull & Armor ","Mutadaptive Remote Armor Repairers",Medium
"Heavy Mutadaptive Compact Remote Armor Repairer Blueprint",49777,"Mutadaptive Remote Armor Repairer Blueprint",100,124700.0000,1,1800,1,"Heavy Mutadaptive Compact Remote Armor Repairer",NULL,"Ship Equipment","Hull & Armor ","Mutadaptive Remote Armor Repairers",Medium
"Heavy Mutadaptive Remote Armor Repairer II Blueprint",49778,"Mutadaptive Remote Armor Repairer Blueprint",10,NULL,1,4680,1,"Heavy Mutadaptive Remote Armor Repairer II",NULL,"Ship Equipment","Hull & Armor ","Mutadaptive Remote Armor Repairers",Medium
"Perun Heavy Mutadaptive Remote Armor Repairer Blueprint",49779,"Mutadaptive Remote Armor Repairer Blueprint",100,124700.0000,1,1800,1,"Perun Heavy Mutadaptive Remote Armor Repairer",NULL,"Ship Equipment","Hull & Armor ","Mutadaptive Remote Armor Repairers",Medium
"Capital Remote Armor Repairer I Blueprint",24570,"Remote Armor Repairer Blueprint",5,24200788.0000,1,36000,1,"Capital Remote Armor Repairer I",NULL,"Ship Equipment","Hull & Armor ","Remote Armor Repairers",Capital
"CONCORD Capital Remote Armor Repairer Blueprint",3537,"Remote Armor Repairer Blueprint",5,24200788.0000,1,36000,1,"CONCORD Capital Remote Armor Repairer",NULL,"Ship Equipment","Hull & Armor ","Remote Armor Repairers",Capital
"Capital I-ax Enduring Remote Armor Repairer Blueprint",41621,"Remote Armor Repairer Blueprint",5,49000000.0000,1,36000,1,"Capital I-ax Enduring Remote Armor Repairer",NULL,"Ship Equipment","Hull & Armor ","Remote Armor Repairers",Capital
"Capital Coaxial Compact Remote Armor Repairer Blueprint",41622,"Remote Armor Repairer Blueprint",5,49000000.0000,1,36000,1,"Capital Coaxial Compact Remote Armor Repairer",NULL,"Ship Equipment","Hull & Armor ","Remote Armor Repairers",Capital
"Capital Remote Armor Repairer II Blueprint",41623,"Remote Armor Repairer Blueprint",10,NULL,1,36000,1,"Capital Remote Armor Repairer II",NULL,"Ship Equipment","Hull & Armor ","Remote Armor Repairers",Capital
"Capital Solace Scoped Remote Armor Repairer Blueprint",41624,"Remote Armor Repairer Blueprint",5,49000000.0000,1,36000,1,"Capital Solace Scoped Remote Armor Repairer",NULL,"Ship Equipment","Hull & Armor ","Remote Armor Repairers",Capital
"Dark Blood Capital Remote Armor Repairer Blueprint",41625,"Remote Armor Repairer Blueprint",5,NULL,1,36000,1,"Dark Blood Capital Remote Armor Repairer",NULL,"Ship Equipment","Hull & Armor ","Remote Armor Repairers",Capital
"Shadow Serpentis Capital Remote Armor Repairer Blueprint",41626,"Remote Armor Repairer Blueprint",5,NULL,1,36000,1,"Shadow Serpentis Capital Remote Armor Repairer",NULL,"Ship Equipment","Hull & Armor ","Remote Armor Repairers",Capital
"Capital Ancillary Remote Armor Repairer Blueprint",41656,"Remote Armor Repairer Blueprint",5,36800000.0000,1,36000,1,"Capital Ancillary Remote Armor Repairer",NULL,"Ship Equipment","Hull & Armor ","Remote Armor Repairers",Capital
"Large Ancillary Remote Armor Repairer Blueprint",41655,"Remote Armor Repairer Blueprint",60,800000.0000,1,2700,1,"Large Ancillary Remote Armor Repairer",NULL,"Ship Equipment","Hull & Armor ","Remote Armor Repairers",Large
"Large Remote Armor Repairer II Blueprint",26915,"Remote Armor Repairer Blueprint",10,NULL,1,7020,1,"Large Remote Armor Repairer II",NULL,"Ship Equipment","Hull & Armor ","Remote Armor Repairers",Large
"Large Remote Armor Repairer I Blueprint",11360,"Remote Armor Repairer Blueprint",60,312440.0000,1,2700,1,"Large Remote Armor Repairer I",NULL,"Ship Equipment","Hull & Armor ","Remote Armor Repairers",Large
"'Peace' Large Remote Armor Repairer Blueprint",23417,"Remote Armor Repairer Blueprint",60,NULL,1,2700,1,"'Peace' Large Remote Armor Repairer",NULL,"Ship Equipment","Hull & Armor ","Remote Armor Repairers",Large
"'Love' Medium Remote Armor Repairer Blueprint",22950,"Remote Armor Repairer Blueprint",100,NULL,1,1800,1,"'Love' Medium Remote Armor Repairer",NULL,"Ship Equipment","Hull & Armor ","Remote Armor Repairers",Medium
"Medium Remote Armor Repairer I Blueprint",11358,"Remote Armor Repairer Blueprint",100,124700.0000,1,1800,1,"Medium Remote Armor Repairer I",NULL,"Ship Equipment","Hull & Armor ","Remote Armor Repairers",Medium
"Medium Remote Armor Repairer II Blueprint",26916,"Remote Armor Repairer Blueprint",10,NULL,1,4680,1,"Medium Remote Armor Repairer II",NULL,"Ship Equipment","Hull & Armor ","Remote Armor Repairers",Medium
"Medium Ancillary Remote Armor Repairer Blueprint",41654,"Remote Armor Repairer Blueprint",100,200000.0000,1,1800,1,"Medium Ancillary Remote Armor Repairer",NULL,"Ship Equipment","Hull & Armor ","Remote Armor Repairers",Medium
"Small Ancillary Remote Armor Repairer Blueprint",41653,"Remote Armor Repairer Blueprint",200,75000.0000,1,900,1,"Small Ancillary Remote Armor Repairer",NULL,"Ship Equipment","Hull & Armor ","Remote Armor Repairers",Small
"Small Remote Armor Repairer II Blueprint",26917,"Remote Armor Repairer Blueprint",10,NULL,1,2340,1,"Small Remote Armor Repairer II",NULL,"Ship Equipment","Hull & Armor ","Remote Armor Repairers",Small
"Small Remote Armor Repairer I Blueprint",11356,"Remote Armor Repairer Blueprint",200,49960.0000,1,900,1,"Small Remote Armor Repairer I",NULL,"Ship Equipment","Hull & Armor ","Remote Armor Repairers",Small
"'Beatnik' Small Remote Armor Repairer Blueprint",22948,"Remote Armor Repairer Blueprint",200,NULL,1,900,1,"'Beatnik' Small Remote Armor Repairer",NULL,"Ship Equipment","Hull & Armor ","Remote Armor Repairers",Small
"Capital Remote Hull Repairer II Blueprint",41631,"Remote Hull Repairer Blueprint",10,NULL,1,36000,1,"Capital Remote Hull Repairer II",NULL,"Ship Equipment","Hull & Armor ","Remote Hull Repairers",Capital
"Capital Remote Hull Repairer I Blueprint",27935,"Remote Hull Repairer Blueprint",5,25000000.0000,1,36000,1,"Capital Remote Hull Repairer I",NULL,"Ship Equipment","Hull & Armor ","Remote Hull Repairers",Capital
"Large Remote Hull Repairer I Blueprint",27905,"Remote Hull Repairer Blueprint",60,3000000.0000,1,2700,1,"Large Remote Hull Repairer I",NULL,"Ship Equipment","Hull & Armor ","Remote Hull Repairers",Large
"Large Remote Hull Repairer II Blueprint",3991,"Remote Hull Repairer Blueprint",10,3000000.0000,1,7020,1,"Large Remote Hull Repairer II",NULL,"Ship Equipment","Hull & Armor ","Remote Hull Repairers",Large
"Medium Remote Hull Repairer II Blueprint",4298,"Remote Hull Repairer Blueprint",10,2000000.0000,1,4680,1,"Medium Remote Hull Repairer II",NULL,"Ship Equipment","Hull & Armor ","Remote Hull Repairers",Medium
"Medium Remote Hull Repairer I Blueprint",27931,"Remote Hull Repairer Blueprint",100,2000000.0000,1,1800,1,"Medium Remote Hull Repairer I",NULL,"Ship Equipment","Hull & Armor ","Remote Hull Repairers",Medium
"Small Remote Hull Repairer I Blueprint",27933,"Remote Hull Repairer Blueprint",200,1000000.0000,1,900,1,"Small Remote Hull Repairer I",NULL,"Ship Equipment","Hull & Armor ","Remote Hull Repairers",Small
"Small Remote Hull Repairer II Blueprint",4300,"Remote Hull Repairer Blueprint",10,1000000.0000,1,2340,1,"Small Remote Hull Repairer II",NULL,"Ship Equipment","Hull & Armor ","Remote Hull Repairers",Small
"Synthetic Hull Conversion Inertia Stabilizers Blueprint",21499,"Hull Mods Blueprint",200,NULL,1,900,1,"Synthetic Hull Conversion Inertia Stabilizers",NULL,"Ship Equipment","Propulsion ","Propulsion Upgrades","Inertial Stabilizers"
"Inertial Stabilizers I Blueprint",1404,"Hull Mods Blueprint",200,54380.0000,1,900,1,"Inertial Stabilizers I",NULL,"Ship Equipment","Propulsion ","Propulsion Upgrades","Inertial Stabilizers"
"Inertial Stabilizers II Blueprint",1406,"Hull Mods Blueprint",10,9999999.0000,1,2340,1,"Inertial Stabilizers II",NULL,"Ship Equipment","Propulsion ","Propulsion Upgrades","Inertial Stabilizers"
"Limited Jump Drive Economizer Blueprint",34123,"Hull Mods Blueprint",200,249980.0000,1,900,1,"Limited Jump Drive Economizer",NULL,"Ship Equipment","Propulsion ","Propulsion Upgrades","Jump Economizers"
"Experimental Jump Drive Economizer Blueprint",34125,"Hull Mods Blueprint",200,249980.0000,1,900,1,"Experimental Jump Drive Economizer",NULL,"Ship Equipment","Propulsion ","Propulsion Upgrades","Jump Economizers"
"Prototype Jump Drive Economizer Blueprint",34127,"Hull Mods Blueprint",200,249980.0000,1,900,1,"Prototype Jump Drive Economizer",NULL,"Ship Equipment","Propulsion ","Propulsion Upgrades","Jump Economizers"
"Overdrive Injector System II Blueprint",1237,"Hull Mods Blueprint",10,10000000000.0000,1,2340,1,"Overdrive Injector System II",NULL,"Ship Equipment","Propulsion ","Propulsion Upgrades",Overdrives
"Overdrive Injector System I Blueprint",1245,"Hull Mods Blueprint",200,249980.0000,1,900,1,"Overdrive Injector System I",NULL,"Ship Equipment","Propulsion ","Propulsion Upgrades",Overdrives
"Synthetic Hull Conversion Overdrive Injector Blueprint",21492,"Hull Mods Blueprint",200,NULL,1,900,1,"Synthetic Hull Conversion Overdrive Injector",NULL,"Ship Equipment","Propulsion ","Propulsion Upgrades",Overdrives
"Limited Hyperspatial Accelerator Blueprint",33982,"Hull Mods Blueprint",200,249980.0000,1,900,1,"Limited Hyperspatial Accelerator",NULL,"Ship Equipment","Propulsion ","Propulsion Upgrades","Warp Accelerators"
"Experimental Hyperspatial Accelerator Blueprint",33984,"Hull Mods Blueprint",200,249980.0000,1,900,1,"Experimental Hyperspatial Accelerator",NULL,"Ship Equipment","Propulsion ","Propulsion Upgrades","Warp Accelerators"
"Prototype Hyperspatial Accelerator Blueprint",33986,"Hull Mods Blueprint",200,249980.0000,1,900,1,"Prototype Hyperspatial Accelerator",NULL,"Ship Equipment","Propulsion ","Propulsion Upgrades","Warp Accelerators"
"'Aura' Warp Core Stabilizer I Blueprint",22876,"Anti Warp Scrambler Blueprint",200,NULL,1,900,1,"'Aura' Warp Core Stabilizer I",NULL,"Ship Equipment","Propulsion ","Propulsion Upgrades","Warp Core Stabilizers"
"'Natura' Warp Core Stabilizer I Blueprint",22878,"Anti Warp Scrambler Blueprint",200,NULL,1,900,1,"'Natura' Warp Core Stabilizer I",NULL,"Ship Equipment","Propulsion ","Propulsion Upgrades","Warp Core Stabilizers"
"Warp Core Stabilizer I Blueprint",11613,"Anti Warp Scrambler Blueprint",200,99940.0000,1,900,1,"Warp Core Stabilizer I",NULL,"Ship Equipment","Propulsion ","Propulsion Upgrades","Warp Core Stabilizers"
"Warp Core Stabilizer II Blueprint",11641,"Anti Warp Scrambler Blueprint",10,NULL,1,2340,1,"Warp Core Stabilizer II",NULL,"Ship Equipment","Propulsion ","Propulsion Upgrades","Warp Core Stabilizers"
"CONCORD Capital Remote Shield Booster Blueprint",3545,"Remote Shield Booster Blueprint",5,24659510.0000,1,36000,1,"CONCORD Capital Remote Shield Booster",NULL,"Ship Equipment",Shield,"Remote Shield Boosters",Capital
"Capital Remote Shield Booster I Blueprint",3617,"Remote Shield Booster Blueprint",5,24659510.0000,1,36000,1,"Capital Remote Shield Booster I",NULL,"Ship Equipment",Shield,"Remote Shield Boosters",Capital
"Capital Remote Shield Booster II Blueprint",3619,"Remote Shield Booster Blueprint",10,9999999.0000,1,36000,1,"Capital Remote Shield Booster II",NULL,"Ship Equipment",Shield,"Remote Shield Boosters",Capital
"Capital Asymmetric Enduring Remote Shield Booster Blueprint",41666,"Remote Shield Booster Blueprint",5,49000000.0000,1,36000,1,"Capital Asymmetric Enduring Remote Shield Booster",NULL,"Ship Equipment",Shield,"Remote Shield Boosters",Capital
"Capital Murky Compact Remote Shield Booster Blueprint",41667,"Remote Shield Booster Blueprint",5,49000000.0000,1,36000,1,"Capital Murky Compact Remote Shield Booster",NULL,"Ship Equipment",Shield,"Remote Shield Boosters",Capital
"Capital S95a Scoped Remote Shield Booster Blueprint",41668,"Remote Shield Booster Blueprint",5,49000000.0000,1,36000,1,"Capital S95a Scoped Remote Shield Booster",NULL,"Ship Equipment",Shield,"Remote Shield Boosters",Capital
"Domination Capital Remote Shield Booster Blueprint",41669,"Remote Shield Booster Blueprint",5,NULL,1,36000,1,"Domination Capital Remote Shield Booster",NULL,"Ship Equipment",Shield,"Remote Shield Boosters",Capital
"Dread Guristas Capital Remote Shield Booster Blueprint",41670,"Remote Shield Booster Blueprint",5,NULL,1,36000,1,"Dread Guristas Capital Remote Shield Booster",NULL,"Ship Equipment",Shield,"Remote Shield Boosters",Capital
"True Sansha Capital Remote Shield Booster Blueprint",41671,"Remote Shield Booster Blueprint",5,NULL,1,36000,1,"True Sansha Capital Remote Shield Booster",NULL,"Ship Equipment",Shield,"Remote Shield Boosters",Capital
"Capital Ancillary Remote Shield Booster Blueprint",41652,"Remote Shield Booster Blueprint",5,36000000.0000,1,36000,1,"Capital Ancillary Remote Shield Booster",NULL,"Ship Equipment",Shield,"Remote Shield Boosters",Capital
"Large Ancillary Remote Shield Booster Blueprint",41651,"Remote Shield Booster Blueprint",100,490000.0000,1,1800,1,"Large Ancillary Remote Shield Booster",NULL,"Ship Equipment",Shield,"Remote Shield Boosters",Large
"Large Remote Shield Booster I Blueprint",3607,"Remote Shield Booster Blueprint",100,312440.0000,1,1800,1,"Large Remote Shield Booster I",NULL,"Ship Equipment",Shield,"Remote Shield Boosters",Large
"Large Remote Shield Booster II Blueprint",3609,"Remote Shield Booster Blueprint",10,9999999.0000,1,4680,1,"Large Remote Shield Booster II",NULL,"Ship Equipment",Shield,"Remote Shield Boosters",Large
"Medium Remote Shield Booster I Blueprint",3597,"Remote Shield Booster Blueprint",100,124700.0000,1,1800,1,"Medium Remote Shield Booster I",NULL,"Ship Equipment",Shield,"Remote Shield Boosters",Medium
"Medium Remote Shield Booster II Blueprint",3599,"Remote Shield Booster Blueprint",10,10000000000.0000,1,4680,1,"Medium Remote Shield Booster II",NULL,"Ship Equipment",Shield,"Remote Shield Boosters",Medium
"Medium Ancillary Remote Shield Booster Blueprint",41650,"Remote Shield Booster Blueprint",100,185000.0000,1,1800,1,"Medium Ancillary Remote Shield Booster",NULL,"Ship Equipment",Shield,"Remote Shield Boosters",Medium
"Small Ancillary Remote Shield Booster Blueprint",41649,"Remote Shield Booster Blueprint",200,75000.0000,1,900,1,"Small Ancillary Remote Shield Booster",NULL,"Ship Equipment",Shield,"Remote Shield Boosters",Small
